CATEGORY	GO_ID	GO_LABEL_FULL	COUNT	PERCENTAGE	P_VALUE	GENES	LIST_TOTAL	POP_HITS	POP_TOTAL	FOLD_ENRICHMENT	BONFERRONI	BENJAMINI	FDR
GOTERM_MF_ALL	GO:0005524	GO:0005524~ATP binding	129	10.849453322119427	5.0941111546644574E-5	DGKG, ERCC6L, BUB1B, ABCA12, MKI67, ACTG2, MYLK, RPS6KA2, AKT3, CHEK1, PDK4, ENPP1, MAP3K8, NEK2, EPHB2, STK32B, PDGFRA, EPHA7, PRKCB, STARD9, MELK, ROR1, TNIK, ROR2, KIF20A, DNA2, EPHA3, PIF1, PFKFB4, BLM, PKDCC, ABCB1, NPR1, NPR2, ABCB4, AK4, PKMYT1, ACACB, PRKCZ, BRIP1, GRK5, ORC1, NLRP3, MYH11, PIP5K1B, PLK4, ATP8B4, ATP8B2, UBE2C, ABCA6, XRCC2, DNAH14, PLK1, ABCA9, DCLK2, CDC7, ABCA8, CDC6, HSPA2, HSPA12A, BMX, DCLK1, EHD2, KIF18A, KIF18B, KIF4A, UBE2T, CDK1, FGFR1, TOP2A, LRRK2, KIF14, ATP2A3, PRKAG2, KIF11, KIF15, PBK, SPEG, TK1, PRKG1, HELLS, HUNK, KIF24, DARS2, KIF23, ABCC9, IRAK3, CIT, TGFBR2, ACTA2, ITPKB, ACTA1, NAV3, KIFC1, PLSCR4, KIT, MCM4, KIF2C, MCM2, ACSS3, PRKAA2, ADCY4, TTK, ADCY2, ATP1A2, AURKB, ADCY5, AURKA, RECQL4, MTHFD1L, RAD54L, CKB, BUB1, NTRK2, POLQ, ATAD5, ATAD2, ATP2B4, MAPK15, TTLL7, CENPE, RAD51, ACTC1, SBK1, KIF26A, AXL, KIF26B, P2RX1, TRIP13	1117	1545	18869	1.410447540655883	0.07771089865615555	0.002074217567591579	0.001965804432761541
GOTERM_MF_ALL	GO:0001228	GO:0001228~transcriptional activator activity, RNA polymerase II transcription regulatory region sequence-specific binding	51	4.289318755256518	5.465725890440091E-5	CSRNP1, TCF21, SIX1, MEOX2, MEOX1, SOX17, SIX4, MYC, CREB3L1, MYB, MYBL2, JUNB, PITX1, SOX4, MEF2C, EBF3, MITF, FOS, SOX10, ETV4, KLF15, HAND2, IRF5, PGR, ATF3, HLF, CEBPD, SRF, PRDM16, E2F2, NDN, MSX1, OTX1, EGR1, EGR2, JUND, EGR3, FOXF1, ZBTB16, KLF4, TBX5, ESR1, NR4A2, FOSL1, NR4A1, KLF6, NR4A3, NFIA, NFIB, MAFF, FOSB	1117	475	18869	1.8137285020967817	0.08313780787496194	0.002169893178504716	0.002056479366278084
GOTERM_MF_ALL	GO:0044325	GO:0044325~ion channel binding	22	1.8502943650126156	7.527641393973933E-5	RYR2, KCND3, KCNE4, TRPC1, PDE4D, CAV1, LRRK2, FHL1, ATP2A3, AKAP6, ABCC9, ANK2, SLC8A1, BAG2, ID2, FXYD1, PDE4B, FLNA, FGF13, SCN4B, SCN1B, SNTA1	1117	140	18869	2.6545466172144776	0.11267454268983179	0.0029155840325928305	0.002763195194617261
GOTERM_MF_ALL	GO:0005198	GO:0005198~structural molecule activity	82	6.896551724137931	8.566912291030281E-5	MYOM1, SRPX, SYNM, SPON1, HSPB6, COL14A1, LAMC3, LRRK2, ELN, HSPB2, MYOM2, LMNB1, TUBB6, EFEMP1, CSRP1, TUBB3, MPZ, EMILIN1, PGM5, BVES, KRT6A, SNTA1, TPM2, TPM1, MAGI2, ANK2, OLFM4, MAPK8IP2, DCN, CLDN11, ACTA1, CLDN5, MMRN1, COL4A4, COL6A2, MAP1B, MAP1A, COL4A6, COL21A1, CHI3L1, CRYAB, MYL9, MATN3, ASF1B, MATN2, FBN2, TNXB, LAMA2, COL11A1, FGL2, LTBP4, DPT, NEXN, FBLN1, PRELP, FBLN2, CENPA, THSD4, FBLN5, ABI3BP, MYH11, DMD, SPTBN2, CTHRC1, SPAG4, TFPI2, SORBS2, ISG15, SORBS1, PODN, MFAP5, PTPRD, MFAP4, SMTN, DES, CILP, COL7A1, MFAP2, MGP, OGN, PLP1, AGRN	1117	896	18869	1.5459717515027498	0.12719960756706017	0.003239108742418116	0.003069810237619184
GOTERM_MF_ALL	GO:0017111	GO:0017111~nucleoside-triphosphatase activity	83	6.980656013456686	1.3351517877673068E-4	TOP2A, DIRAS3, ERCC6L, DIRAS1, LRRK2, DSCC1, KIF14, ATP2A3, KIF11, ABCA12, RND3, RERG, KIF15, RGS5, RNF112, TUBB6, RGS2, TUBB3, RAC3, RGS9, GBP6, HELLS, STARD9, RHOH, KIF24, KIF23, ABCC9, GEM, RHOB, NAV3, RAB37, KIFC1, RHOJ, MCM4, KIF2C, KIF20A, DNA2, MCM2, RASL12, GNAZ, PIF1, BLM, ABCB1, RRAD, ABCB4, ATP1A2, RAP1GAP, RECQL4, GNA14, BRIP1, RASD1, ORC1, RRAS, RAB23, RAD54L, MYH11, TPPP, POLQ, ATP8B4, ATAD5, ATP8B2, ABCA6, XRCC2, ATAD2, DNAH14, ATP2B4, ABCA9, HSPA2, ABCA8, GNG11, GNAO1, CENPE, KIF18A, RAD51, ACTC1, GNAL, KIF18B, KIF26A, KIF26B, KIF4A, RGS11, TRIP13, RAB9B	1117	922	18869	1.5206976775799756	0.19106463434839238	0.004913915705547292	0.00465708006098783
GOTERM_MF_ALL	GO:0030234	GO:0030234~enzyme regulator activity	100	8.410428931875526	1.361538356700761E-4	GMFG, ARHGAP39, FRY, CDC20, RGS5, RGS2, CCND2, PTTG1, RGS9, STARD8, SERPINF1, ATP1B2, MAPK8IP2, DEPDC1B, CCNE2, BIN1, PPP1R3B, CCNE1, NUPR1, PIF1, FBLN1, RASAL1, ARHGAP15, FBLN2, IQGAP3, RAP1GAP, C3, SOCS3, CCNB2, CCNB1, ARHGAP20, BAG2, RACGAP1, PRKAR2B, NCKAP1L, A2M, ECT2, GPIHBP1, STARD13, CAV1, TFPI2, PARVA, ESR1, ARHGAP24, RCAN1, TPX2, RCAN2, PPP1R1B, PKIG, FGF13, CPEB2, CDKN1C, ARHGAP11A, SERPINA3, LRRK2, NCAPG2, ATP2A3, HSPB2, WFDC1, PRKAG2, AREG, ARHGAP6, CKS1B, NCS1, TIMP4, GARNL3, ARHGEF15, RHOH, CIT, CCNA2, ARHGAP10, ZEB2, TAL1, DEPDC1, CKS2, RGN, CDC42EP2, BIRC5, PPP1R12B, GAS6, HBEGF, BIRC3, ITIH5, PCOLCE2, TFPI, LTC4S, CST6, PLN, SLIT2, SNCA, PPP1R14A, ATP2B4, KLF4, PPP2R2B, COL7A1, DLC1, APOC1, PI16, RGS11, RECK	1117	1161	18869	1.455001669446507	0.19444758850315946	0.004913915705547292	0.00465708006098783
GOTERM_MF_ALL	GO:0016462	GO:0016462~pyrophosphatase activity	87	7.317073170731707	1.4593902777214733E-4	TOP2A, DIRAS3, ERCC6L, DIRAS1, LRRK2, DSCC1, KIF14, ATP2A3, KIF11, ABCA12, RND3, RERG, KIF15, RGS5, RNF112, TUBB6, RGS2, TUBB3, ENPP2, ENPP1, RAC3, RGS9, GBP6, HELLS, STARD9, RHOH, KIF24, KIF23, ABCC9, GEM, RHOB, NAV3, RAB37, KIFC1, RHOJ, MCM4, KIF2C, KIF20A, DNA2, MCM2, RASL12, GNAZ, PIF1, BLM, ABCB1, RRAD, ABCB4, PRUNE2, ATP1A2, RAP1GAP, RECQL4, GNA14, TRPM2, BRIP1, RASD1, ORC1, RRAS, RAB23, RAD54L, MYH11, TPPP, POLQ, ATP8B4, ATAD5, ATP8B2, ABCA6, XRCC2, ATAD2, DNAH14, ATP2B4, ABCA9, HSPA2, ABCA8, GNG11, GNAO1, CENPE, KIF18A, RAD51, ACTC1, GNAL, KIF18B, KIF26A, KIF26B, KIF4A, RGS11, TRIP13, RAB9B	1117	981	18869	1.498117773963133	0.2068699620578366	0.005150026135603778	0.004880849706601817
GOTERM_MF_ALL	GO:0016817	GO:0016817~hydrolase activity, acting on acid anhydrides	87	7.317073170731707	1.588387600637699E-4	TOP2A, DIRAS3, ERCC6L, DIRAS1, LRRK2, DSCC1, KIF14, ATP2A3, KIF11, ABCA12, RND3, RERG, KIF15, RGS5, RNF112, TUBB6, RGS2, TUBB3, ENPP2, ENPP1, RAC3, RGS9, GBP6, HELLS, STARD9, RHOH, KIF24, KIF23, ABCC9, GEM, RHOB, NAV3, RAB37, KIFC1, RHOJ, MCM4, KIF2C, KIF20A, DNA2, MCM2, RASL12, GNAZ, PIF1, BLM, ABCB1, RRAD, ABCB4, PRUNE2, ATP1A2, RAP1GAP, RECQL4, GNA14, TRPM2, BRIP1, RASD1, ORC1, RRAS, RAB23, RAD54L, MYH11, TPPP, POLQ, ATP8B4, ATAD5, ATP8B2, ABCA6, XRCC2, ATAD2, DNAH14, ATP2B4, ABCA9, HSPA2, ABCA8, GNG11, GNAO1, CENPE, KIF18A, RAD51, ACTC1, GNAL, KIF18B, KIF26A, KIF26B, KIF4A, RGS11, TRIP13, RAB9B	1117	983	18869	1.495069721523737	0.22295419987013454	0.005366722361303545	0.0050862198701271
GOTERM_MF_ALL	GO:0016818	GO:0016818~hydrolase activity, acting on acid anhydrides, in phosphorus-containing anhydrides	87	7.317073170731707	1.588387600637699E-4	TOP2A, DIRAS3, ERCC6L, DIRAS1, LRRK2, DSCC1, KIF14, ATP2A3, KIF11, ABCA12, RND3, RERG, KIF15, RGS5, RNF112, TUBB6, RGS2, TUBB3, ENPP2, ENPP1, RAC3, RGS9, GBP6, HELLS, STARD9, RHOH, KIF24, KIF23, ABCC9, GEM, RHOB, NAV3, RAB37, KIFC1, RHOJ, MCM4, KIF2C, KIF20A, DNA2, MCM2, RASL12, GNAZ, PIF1, BLM, ABCB1, RRAD, ABCB4, PRUNE2, ATP1A2, RAP1GAP, RECQL4, GNA14, TRPM2, BRIP1, RASD1, ORC1, RRAS, RAB23, RAD54L, MYH11, TPPP, POLQ, ATP8B4, ATAD5, ATP8B2, ABCA6, XRCC2, ATAD2, DNAH14, ATP2B4, ABCA9, HSPA2, ABCA8, GNG11, GNAO1, CENPE, KIF18A, RAD51, ACTC1, GNAL, KIF18B, KIF26A, KIF26B, KIF4A, RGS11, TRIP13, RAB9B	1117	983	18869	1.495069721523737	0.22295419987013454	0.005366722361303545	0.0050862198701271
GOTERM_MF_ALL	GO:0030551	GO:0030551~cyclic nucleotide binding	10	0.8410428931875525	2.365956547635032E-4	POPDC2, PRKAR2B, PDE4D, PDE2A, PDE4B, PDE5A, BVES, PRKG1, RAPGEF3, SLC19A1	1117	37	18869	4.565559292506472	0.3132317314567724	0.007827372911759231	0.007418259592064006
GOTERM_MF_ALL	GO:0005178	GO:0005178~integrin binding	23	1.9343986543313711	2.4830363145422366E-4	TNXB, ITGB3, LTBP4, ISG15, FBLN1, GFRA1, IGF1, FGF2, CX3CL1, FBLN5, ADAMTS5, CXCL12, ITGA8, SPP1, ITGA7, EMILIN1, DMD, ITGA5, ADAMTS8, FERMT2, JAM2, ITGA9, JAM3	1117	163	18869	2.3836140846153424	0.32588538370755293	0.008047064627536881	0.007626468680379727
GOTERM_MF_ALL	GO:0016301	GO:0016301~kinase activity	76	6.3919259882254	3.2129715508111886E-4	CDKN1C, DGKG, LRRK2, BUB1B, PRKAG2, CKS1B, MYLK, EFEMP1, RPS6KA2, AKT3, CHEK1, PDK4, PBK, SPEG, NEK2, MAP3K8, TK1, EPHB2, SKP2, STK32B, PRKG1, PDGFRA, EPHA7, PRKCB, MAGI2, HUNK, IRAK3, MAPK8IP2, TGFBR2, CIT, TGFBR3, ITPKB, MELK, CCNE1, KIT, ROR1, TNIK, ROR2, EPHA3, PFKFB4, PRKAA2, PKDCC, NPR1, NPR2, LTBP4, AKAP6, AK4, TTK, SGMS2, PKMYT1, PRKCZ, AURKB, AURKA, GRK5, PRKAR2B, CCL2, PIP5K1B, CKB, BUB1, PLK4, NTRK2, PLK1, DCLK2, CDC7, BMX, MAPK15, DCLK1, EFNA3, SBK1, DLG2, AXL, CDK1, NAGS, PKIG, CDKN3, FGFR1	1117	850	18869	1.5103944388856705	0.39968566298635877	0.01003480923563979	0.009510319836044008
GOTERM_MF_ALL	GO:0008083	GO:0008083~growth factor activity	23	1.9343986543313711	3.222766190287338E-4	CSF3, BDNF, IL34, HGF, GMFG, BMP8B, INHBB, NRG2, INHBA, IGF1, FGF2, AREG, DKK1, BMP5, FGF7, IL6, CXCL12, EFEMP1, PDGFD, OGN, FGF13, FGF11, HBEGF	1117	166	18869	2.3405367216403663	0.40061895946683124	0.01003480923563979	0.009510319836044008
GOTERM_MF_ALL	GO:0003682	GO:0003682~chromatin binding	59	4.96215306980656	3.4639107633304214E-4	TOP2A, THRA, SIX1, MEOX1, CHAF1B, EXO1, CREB3L1, DNMT3B, RCC1, SVEP1, TSPYL2, WDHD1, HELLS, PRKCB, ARID5A, MITF, FOS, SOX10, TOX2, ZEB1, TAL1, CKS2, NUPR1, TOX, JDP2, HDAC4, PRKAA2, TSHZ3, UHRF1, SRF, CDCA5, GATA6, CENPA, NCAPH, BRIP1, CDC45, ORC1, NDN, APBB1, PPARGC1A, EGR1, CDT1, POLQ, EGR2, CBX2, ATAD2, NAP1L3, NAP1L2, KLF4, MAPK15, ESR1, NAP1L5, PER1, CENPF, RAD51, NFIA, UBE2T, CDK1, EZH2	1117	619	18869	1.6101156600228805	0.4231449866415756	0.010578250561862903	0.010025357113100547
GOTERM_MF_ALL	GO:0003774	GO:0003774~motor activity	18	1.5138772077375946	5.154684855624258E-4	STARD9, DNAH14, KIF14, KIF24, KIF23, KIF11, KIF15, CENPE, KIF18A, ACTC1, KIF18B, KIF26A, KIFC1, KIF4A, KIF26B, MYH11, KIF2C, KIF20A	1117	117	18869	2.598856828042146	0.5590284859276582	0.015444602925908156	0.01463735982587643
GOTERM_MF_ALL	GO:0004222	GO:0004222~metalloendopeptidase activity	18	1.5138772077375946	5.697261422953967E-4	MMP1, ADAM33, ECE2, ADAMTS12, THSD4, MMP12, ADAMTS4, ADAMTSL1, MMP11, ADAMTS15, ADAMTS5, MMP13, ADAMTS1, ADAMTSL4, ADAMTSL3, TLL1, ADAMTS8, ADAMTS9	1117	118	18869	2.5768326176350094	0.5954512111969519	0.016754168777131297	0.015878478595455037
GOTERM_MF_ALL	GO:0008179	GO:0008179~adenylate cyclase binding	6	0.5046257359125316	6.188127318512742E-4	AKAP12, AKAP6, ADCY2, ADRB2, CAP2, ADCY5	1117	13	18869	7.7965704841264385	0.6258052104405304	0.017866811239633153	0.016932966571566684
GOTERM_MF_ALL	GO:0004672	GO:0004672~protein kinase activity	56	4.7098402018502945	7.345324401641649E-4	LRRK2, BUB1B, PRKAG2, MYLK, EFEMP1, RPS6KA2, AKT3, CHEK1, PDK4, PBK, SPEG, NEK2, MAP3K8, EPHB2, STK32B, PRKG1, PDGFRA, EPHA7, PRKCB, HUNK, IRAK3, TGFBR2, CIT, TGFBR3, MELK, KIT, ROR1, TNIK, ROR2, EPHA3, PRKAA2, PKDCC, NPR1, NPR2, LTBP4, TTK, PKMYT1, PRKCZ, AURKB, AURKA, GRK5, CCL2, BUB1, PLK4, NTRK2, PLK1, DCLK2, CDC7, BMX, MAPK15, DCLK1, EFNA3, SBK1, AXL, CDK1, FGFR1	1117	597	18869	1.5845626221228493	0.6886588796715408	0.02082924133894096	0.01974055932941193
GOTERM_MF_ALL	GO:0019838	GO:0019838~growth factor binding	20	1.682085786375105	8.45738707826356E-4	NGFR, PDGFRA, NTRK2, KL, EPHA7, IGFBP5, IL11RA, DUSP1, ITGB3, LTBP4, LIFR, CHRDL1, TGFBR2, GHR, TGFBR3, IGFBP6, A2M, IL6ST, IL6R, FGFR1	1117	144	18869	2.346190191982493	0.7390956244433198	0.023418977763364587	0.022194937993616944
GOTERM_MF_ALL	GO:0005518	GO:0005518~collagen binding	13	1.0933557611438183	8.650921487560545E-4	LRRC15, TNXB, PCOLCE2, COL14A1, PODN, DCN, MMP12, MMP13, ABI3BP, COL6A2, SPARCL1, RELL2, ITGA9	1117	71	18869	3.093005661543117	0.7469987608354576	0.023418977763364587	0.022194937993616944
GOTERM_MF_ALL	GO:0030165	GO:0030165~PDZ domain binding	15	1.2615643397813288	8.811798410771825E-4	FZD2, DTNA, FZD7, USHBP1, SDC2, GRIK5, KIF14, ATP2B4, LPAR1, CIT, TGFBR3, TMEM88, DMD, SLC26A6, SNTA1	1117	91	18869	2.784489458616585	0.753385890441297	0.023418977763364587	0.022194937993616944
GOTERM_MF_ALL	GO:0019887	GO:0019887~protein kinase regulator activity	27	2.2708158116063917	8.995954934289923E-4	CDKN1C, GMFG, NCAPG2, PRKAG2, AREG, CKS1B, CCNB2, SOCS3, CCNB1, CCND2, PRKAR2B, NCKAP1L, SNCA, PARVA, MAPK8IP2, CIT, CCNA2, TPX2, CCNE2, CCNE1, TAL1, PPP1R1B, CKS2, PKIG, FGF13, GAS6, HBEGF	1117	226	18869	2.01813882000618	0.7604996956114298	0.023418977763364587	0.022194937993616944
GOTERM_MF_ALL	GO:0051015	GO:0051015~actin filament binding	27	2.2708158116063917	8.995954934289923E-4	MYOM1, TAGLN, NEXN, RCSD1, IQGAP3, MYOM2, SYNE1, CFL2, ANXA6, FLNA, MYH11, DMD, FLNC, PKNOX2, SPTBN2, TMOD1, SVIL, MARCKSL1, GSN, TPM2, TPM1, DSTN, CORO2B, CACNB2, BIN1, FERMT2, GAS7	1117	226	18869	2.01813882000618	0.7604996956114298	0.023418977763364587	0.022194937993616944
GOTERM_MF_ALL	GO:0098631	GO:0098631~protein binding involved in cell adhesion	12	1.0092514718250631	9.264088571577289E-4	NFASC, EPCAM, PALLD, CNTN1, NEXN, NRCAM, EMILIN1, STXBP6, CNTN4, CD200, IGSF9, JAM3	1117	62	18869	3.269529557859474	0.7704923974877464	0.023728020405910863	0.022487827903586805
GOTERM_MF_ALL	GO:0019199	GO:0019199~transmembrane receptor protein kinase activity	20	1.682085786375105	0.001000967626403257	PDGFRA, NTRK2, EPHA7, PKDCC, LTBP4, TTK, BMX, TGFBR2, TGFBR3, EFNA3, MELK, EFEMP1, AXL, KIT, PBK, ROR1, ROR2, EPHB2, EPHA3, FGFR1	1117	146	18869	2.3140506003114996	0.7961422147415349	0.02504728458599322	0.023738138099445714
GOTERM_MF_ALL	GO:0099106	GO:0099106~ion channel regulator activity	18	1.5138772077375946	0.0010094623510727746	LYNX1, PRKCB, KCNE4, RRAD, NRXN1, CAV1, ITPR1, NRXN2, ABCC9, ADRB2, PRKCZ, GEM, KCNMB1, FXYD1, FLNA, FXYD6, SCN1B, PRKG1	1117	124	18869	2.4521471683946054	0.7988764444854083	0.02504728458599322	0.023738138099445714
GOTERM_MF_ALL	GO:0098632	GO:0098632~protein binding involved in cell-cell adhesion	11	0.9251471825063078	0.0011110116928107518	NFASC, EPCAM, PALLD, CNTN1, NEXN, NRCAM, STXBP6, CNTN4, CD200, IGSF9, JAM3	1117	54	18869	3.44107894824099	0.8288589769586521	0.02714287027974575	0.02572419381046433
GOTERM_MF_ALL	GO:0030023	GO:0030023~extracellular matrix constituent conferring elasticity	5	0.42052144659377627	0.0012060901976361138	FBN2, ELN, EMILIN1, FBLN2, FBLN5	1117	9	18869	9.384760767929972	0.8528682975534105	0.02901926111888104	0.027502511324884113
GOTERM_MF_ALL	GO:0019207	GO:0019207~kinase regulator activity	29	2.4390243902439024	0.0012733966063464197	CDKN1C, GMFG, NCAPG2, PRKAG2, AREG, CKS1B, CCNB2, SOCS3, CCNB1, CCND2, PRKAR2B, NCKAP1L, SNCA, RHOH, PARVA, KLF4, MAPK8IP2, CIT, CCNA2, TPX2, CCNE2, CCNE1, TAL1, PPP1R1B, CKS2, PKIG, FGF13, GAS6, HBEGF	1117	256	18869	1.9136113753357207	0.867800403904619	0.030181400162359914	0.028603908844050174
GOTERM_MF_ALL	GO:0051371	GO:0051371~muscle alpha-actinin binding	6	0.5046257359125316	0.0013073491545922194	PDLIM3, PALLD, SYNPO2, LDB3, PDLIM4, PDLIM7	1117	15	18869	6.75702775290958	0.8747481433923416	0.03053044790430065	0.02893471290678368
GOTERM_MF_ALL	GO:0001664	GO:0001664~G-protein coupled receptor binding	33	2.775441547518924	0.0014832298638871864	GNAZ, WNT2B, CNRIP1, CXCL2, CX3CL1, C3, GNA14, EDNRB, PALM, S1PR1, BDKRB2, RSPO3, CCL2, FLNA, WNT2, CTHRC1, TUB, CCL21, FZD7, PDE4D, MAGI2, WNT9A, ADRA2A, GNAO1, REEP1, SFRP1, GNAL, CXCL12, REEP2, PPP1R1B, AGTR1, ROR2, NES	1117	309	18869	1.8040608078156644	0.9053072207012651	0.034135782954389154	0.03235160790072776
GOTERM_MF_ALL	GO:0017147	GO:0017147~Wnt-protein binding	8	0.6728343145500421	0.001520796640393474	SFRP1, FZD2, FZD7, ROR1, ROR2, APCDD1, RECK, CTHRC1	1117	30	18869	4.504685168606386	0.9107990250849586	0.03450035807064052	0.03269712776845969
GOTERM_MF_ALL	GO:0043142	GO:0043142~single-stranded DNA-dependent ATPase activity	7	0.5887300252312868	0.0017843444028764546	POLQ, PIF1, RAD51, DSCC1, MCM4, DNA2, MCM2	1117	23	18869	5.1412167685181585	0.9413442651446133	0.03881560153106589	0.03678682638806937
GOTERM_MF_ALL	GO:0030552	GO:0030552~cAMP binding	7	0.5887300252312868	0.0017843444028764546	POPDC2, PRKAR2B, PDE4D, PDE2A, PDE4B, BVES, RAPGEF3	1117	23	18869	5.1412167685181585	0.9413442651446133	0.03881560153106589	0.03678682638806937
GOTERM_MF_ALL	GO:0017116	GO:0017116~single-stranded DNA-dependent ATP-dependent DNA helicase activity	7	0.5887300252312868	0.0017843444028764546	POLQ, PIF1, RAD51, DSCC1, MCM4, DNA2, MCM2	1117	23	18869	5.1412167685181585	0.9413442651446133	0.03881560153106589	0.03678682638806937
GOTERM_MF_ALL	GO:0008134	GO:0008134~transcription factor binding	48	4.037005887300253	0.001845320132549629	HDAC4, THRA, SRF, NCAPG2, GATA6, CREM, SIX1, TCF21, LDB2, SOX17, MYC, E2F1, ENPP2, FLNA, E2F2, APBB1, PITX2, PPARGC1A, JUNB, CD34, PITX1, PPARGC1B, MYOCD, EGR2, MEF2C, JUND, GPX3, ZBTB16, ARID5A, FOS, KLF4, TBX5, ESR1, NFATC4, CIT, NR4A2, PER2, PER1, PER3, NFIA, TAL1, ID2, HAND2, ID4, FOSB, PGR, ZFPM2, EZH2	1117	512	18869	1.5836783795881828	0.9467669287185196	0.03930426970129473	0.03724995333781397
GOTERM_MF_ALL	GO:0008237	GO:0008237~metallopeptidase activity	24	2.0185029436501263	0.001856309967000696	CPA3, TFRC, CPXM2, CPQ, MMP1, ADAM33, ECE2, ADAMTS12, THSD4, NAALADL1, MMP12, ADAMTS4, ADAMTSL1, MMP11, ADAMTS15, ADAMTS5, MMP13, ADAMTS1, ADAMTSL4, XPNPEP2, ADAMTSL3, TLL1, ADAMTS8, ADAMTS9	1117	201	18869	2.0170232098237553	0.9476895778934623	0.03930426970129473	0.03724995333781397
GOTERM_MF_ALL	GO:0015026	GO:0015026~coreceptor activity	10	0.8410428931875525	0.0020648574121014374	TGFBR3, NGFR, ITGB3, ROR1, CSPG4, ROR2, RECK, GPC6, RAMP1, RGMA	1117	49	18869	3.4474631392395807	0.9624613257788812	0.04314465224233004	0.04088961059490347
GOTERM_MF_ALL	GO:0008081	GO:0008081~phosphoric diester hydrolase activity	14	1.1774600504625736	0.0021501039703996135	PDE1A, PLCL1, PDE4D, PDE2A, EDNRA, PLCB4, BDKRB2, ENPP2, PDE4B, ENPP1, PDE5A, PDE7B, SMPDL3B, PLCD4	1117	89	18869	2.6572581050768007	0.9672234184246052	0.04434240396096865	0.042024759421447
GOTERM_MF_ALL	GO:0004114	GO:0004114~3',5'-cyclic-nucleotide phosphodiesterase activity	7	0.5887300252312868	0.002261477777557478	PDE1A, PDE4D, PDE2A, PDE4B, ENPP1, PDE5A, PDE7B	1117	24	18869	4.926999403163235	0.9725473776316793	0.046041368086683014	0.04363492378492314
GOTERM_MF_ALL	GO:0004857	GO:0004857~enzyme inhibitor activity	40	3.36417157275021	0.0025502957590417103	CDKN1C, ITIH5, SERPINA3, PIF1, LRRK2, GMFG, NCAPG2, WFDC1, PRKAG2, FRY, TFPI, CST6, C3, SOCS3, PLN, PTTG1, PRKAR2B, SLIT2, A2M, TIMP4, SNCA, PPP1R14A, SERPINF1, TFPI2, ATP2B4, RHOH, PARVA, CIT, BIN1, COL7A1, APOC1, PPP1R1B, BIRC5, PI16, PKIG, PPP1R12B, GAS6, CPEB2, RECK, BIRC3	1117	412	18869	1.6400552798324222	0.9826652590728704	0.051264172979218176	0.04858474832098448
GOTERM_MF_ALL	GO:0097493	GO:0097493~structural molecule activity conferring elasticity	5	0.42052144659377627	0.00287114831304335	FBN2, ELN, EMILIN1, FBLN2, FBLN5	1117	11	18869	7.6784406283063396	0.9895999161432739	0.056992294013910504	0.05401347763912802
GOTERM_MF_ALL	GO:0004714	GO:0004714~transmembrane receptor protein tyrosine kinase activity	17	1.4297729184188395	0.0033707987562660497	PDGFRA, NTRK2, EPHA7, PKDCC, TTK, BMX, EFNA3, MELK, EFEMP1, AXL, KIT, PBK, ROR1, ROR2, EPHB2, EPHA3, FGFR1	1117	127	18869	2.261210074792576	0.9953078782659015	0.0660843015425986	0.0626302731874124
GOTERM_MF_ALL	GO:0004112	GO:0004112~cyclic-nucleotide phosphodiesterase activity	7	0.5887300252312868	0.0034959037363701995	PDE1A, PDE4D, PDE2A, PDE4B, ENPP1, PDE5A, PDE7B	1117	26	18869	4.547999449073756	0.9961559222228283	0.06770116016287656	0.0641626234541116
GOTERM_MF_ALL	GO:0019210	GO:0019210~kinase inhibitor activity	12	1.0092514718250631	0.003995987741574638	CDKN1C, SOCS3, PRKAR2B, GMFG, PPP1R1B, NCAPG2, PRKAG2, RHOH, PARVA, PKIG, CIT, SNCA	1117	74	18869	2.7393355755038837	0.9982677617794709	0.07645335582675332	0.07245736808517868
GOTERM_MF_ALL	GO:0008094	GO:0008094~DNA-dependent ATPase activity	12	1.0092514718250631	0.004438585791825268	TOP2A, POLQ, PIF1, BLM, ERCC6L, RAD51, DSCC1, XRCC2, RAD54L, MCM4, DNA2, MCM2	1117	75	18869	2.7028111011638316	0.9991447898316439	0.08391040758831578	0.07952466210353605
GOTERM_MF_ALL	GO:0046872	GO:0046872~metal ion binding	298	25.063078216989066	0.00469607999237988	SPON1, MT1M, ADARB1, ANTXR2, MYLK, ZDBF2, RNF112, RPS6KA2, ZC3H12B, JUNB, PRKCB, CACNA2D1, EBF1, EBF3, ESCO2, SYTL5, CYP27A1, CYP39A1, CH25H, SPARCL1, DNA2, ZFPM2, FREM1, MYL9, PADI1, RNF122, NECAB1, PIF1, TSHZ3, PDE1A, GATA6, GATA5, PCDH19, ADAMTS12, PCDH18, PRKCZ, TRPM2, ADAMTS15, BRIP1, RACGAP1, PRDM16, ZSCAN18, EGR1, EGR2, DTNA, EGR3, ADHFE1, PDE2A, PLK1, NR2F1, CDC7, EHD2, MEX3A, DCHS1, FAT4, ZNF135, TOP2A, RYR2, FEN1, TGFB1I1, BRCA1, RYR3, CSRP1, NCS1, ANXA6, RNF150, TK1, LMCD1, ZNF488, TIMP4, ZCCHC24, KCND3, BHMT2, HBA2, CBFA2T3, NAALADL1, CIT, MMP12, MMP11, F8, ZEB2, PLCB4, MMP13, ZEB1, KCNMA1, KIT, PLSCR4, RGN, GAS6, CRYAB, PDZRN3, MATN3, PDZRN4, MATN2, ZNF471, ADH1C, ADH1B, COL11A1, HAAO, PRUNE2, ADCY4, PRICKLE2, ADCY2, CRIP2, PTGS1, ADCY5, NT5E, RELN, RAD54L, DMD, RUNX1T1, AOC3, GSN, F10, F12, ADAM33, TTLL7, SMOC2, MIS18A, MSRB3, CD69, AGRN, PLCD4, LIMS2, ZFP28, DGKG, ZNF331, PRDM8, STEAP4, PRDM6, F13A1, SLC8A1, CELSR3, NR3C2, ZFP36, EFEMP1, EME1, PHYHD1, ENPP2, ENPP1, OIP5, SVEP1, NEK2, MAP3K8, STK32B, PAMR1, CPA3, CSGALNACT1, LMO3, USP2, HIC1, GEM, FOXP2, TRAIP, PCP4, MELK, PGR, MASP1, ROR2, FBN2, ZNF671, GNAZ, BLM, RNASEH2A, RNF180, ITPR1, LTBP4, FBLN1, RASAL1, CACNA1C, PKMYT1, RASGRP2, ACACB, FBLN2, LPP, CACNA1H, FBLN5, SCUBE1, ORC1, NPTX1, TPPP, ZNF423, LONRF2, ATP8B4, ATP8B2, EPHX2, ZBTB16, CYBRD1, SMAD9, BMX, ESR1, SELE, GNAO1, SELP, NR4A2, NR4A1, GNAL, NR4A3, KIF4A, SNED1, PCDHGB7, BNC2, THRA, CPQ, CPXM2, LRRK2, FHL1, ATP2A3, MCM10, LDB3, ECE2, SOBP, SGCE, ADAMTS4, FYCO1, ADAMTS5, HEPH, SGCA, ADAMTS1, EXO1, PDE4B, DNMT3B, AOX1, PGM5, CA9, ADAMTS8, ADAMTS9, PTGIS, PEG3, MMP1, PDE4D, PLA2G4C, IRAK3, MYRIP, KLF15, TGFBR2, MMRN1, ITGA8, CASQ2, ITGA7, BIRC5, PDE5A, ITGA5, SMPDL3B, MCM2, ITGA9, BIRC3, CREB5, HDAC4, COLEC12, COLEC11, PRKAA2, C1S, ZBTB47, C1R, UHRF1, NRXN1, NRXN3, NRXN2, ATP1A2, LRP8, NCALD, CYGB, AURKB, GNA14, PDLIM3, CLEC3B, SLIT3, SLIT2, BCO2, SLC25A23, PDLIM4, PDLIM7, SLC25A25, JAZF1, SNCA, GALNT6, RRM2, PCDH7, EYA4, PLA2G2A, HAGHL, ATP2B4, SYT15, KLF4, S100B, SOD3, KLF2, KLF6, SYT11, SCD, XPNPEP2, MGP, KLF9, CD248, TLL1, PDE7B, CDO1	1117	4401	18869	1.143827692778377	0.999432880351444	0.08773382385763824	0.08314823986507906
GOTERM_MF_ALL	GO:0051393	GO:0051393~alpha-actinin binding	7	0.5887300252312868	0.005171248327761961	PDLIM3, PALLD, SYNPO2, LDB3, CACNA1C, PDLIM4, PDLIM7	1117	28	18869	4.223142345568488	0.9997343281950294	0.09226901510658418	0.08744639026159272
GOTERM_MF_ALL	GO:0004003	GO:0004003~ATP-dependent DNA helicase activity	7	0.5887300252312868	0.005171248327761961	POLQ, PIF1, RAD51, DSCC1, MCM4, DNA2, MCM2	1117	28	18869	4.223142345568488	0.9997343281950294	0.09226901510658418	0.08744639026159272
GOTERM_MF_ALL	GO:0008026	GO:0008026~ATP-dependent helicase activity	7	0.5887300252312868	0.005171248327761961	POLQ, PIF1, RAD51, DSCC1, MCM4, DNA2, MCM2	1117	28	18869	4.223142345568488	0.9997343281950294	0.09226901510658418	0.08744639026159272
GOTERM_MF_ALL	GO:0070035	GO:0070035~purine NTP-dependent helicase activity	7	0.5887300252312868	0.005171248327761961	POLQ, PIF1, RAD51, DSCC1, MCM4, DNA2, MCM2	1117	28	18869	4.223142345568488	0.9997343281950294	0.09226901510658418	0.08744639026159272
GOTERM_MF_ALL	GO:0035173	GO:0035173~histone kinase activity	6	0.5046257359125316	0.005272805634610827	PRKAA2, PRKCB, CHEK1, CDK1, AURKB, AURKA	1117	20	18869	5.067770814682185	0.9997740887699365	0.09303572608624437	0.08817302755654771
GOTERM_MF_ALL	GO:0016773	GO:0016773~phosphotransferase activity, alcohol group as acceptor	60	5.046257359125315	0.005634127582419412	DGKG, LRRK2, BUB1B, PRKAG2, MYLK, EFEMP1, RPS6KA2, AKT3, CHEK1, PDK4, PBK, SPEG, NEK2, MAP3K8, EPHB2, STK32B, PRKG1, PDGFRA, EPHA7, PRKCB, HUNK, IRAK3, TGFBR2, CIT, TGFBR3, ITPKB, MELK, KIT, ROR1, TNIK, ROR2, EPHA3, PFKFB4, PRKAA2, PKDCC, NPR1, NPR2, LTBP4, TTK, PKMYT1, PRKCZ, AURKB, AURKA, GRK5, CCL2, PIP5K1B, BUB1, PLK4, NTRK2, PLK1, DCLK2, CDC7, BMX, MAPK15, DCLK1, EFNA3, SBK1, AXL, CDK1, FGFR1	1117	713	18869	1.421534590373684	0.9998731231880108	0.09831862198771457	0.09317980232462875
GOTERM_MF_ALL	GO:0003678	GO:0003678~DNA helicase activity	12	1.0092514718250631	0.006003692865864234	RECQL4, POLQ, PIF1, BLM, ERCC6L, BRIP1, RAD51, DSCC1, RAD54L, MCM4, DNA2, MCM2	1117	78	18869	2.598856828042146	0.9999296901414078	0.10362895946730874	0.09821258438180079
GOTERM_MF_ALL	GO:0042805	GO:0042805~actinin binding	8	0.6728343145500421	0.006244953709032661	PDLIM3, CSRP1, PALLD, SYNPO2, LDB3, CACNA1C, PDLIM4, PDLIM7	1117	38	18869	3.5563303962682	0.9999521807163688	0.1065352124620185	0.1009669362439155
GOTERM_MF_ALL	GO:0008047	GO:0008047~enzyme activator activity	52	4.373423044575273	0.006306240536164822	ARHGAP11A, LRRK2, GMFG, NCAPG2, ATP2A3, HSPB2, PRKAG2, ARHGAP39, ARHGAP6, AREG, CKS1B, RGS5, RGS2, NCS1, RGS9, GARNL3, ARHGEF15, STARD8, ATP1B2, MAPK8IP2, ARHGAP10, DEPDC1B, TAL1, CKS2, CDC42EP2, DEPDC1, NUPR1, PPP1R12B, GAS6, HBEGF, PCOLCE2, FBLN1, RASAL1, ARHGAP15, LTC4S, FBLN2, IQGAP3, RAP1GAP, ARHGAP20, CCNB1, RACGAP1, NCKAP1L, ECT2, GPIHBP1, STARD13, CAV1, ARHGAP24, TPX2, DLC1, APOC1, RGS11, FGF13	1117	603	18869	1.4567389848727117	0.9999566420152101	0.1065352124620185	0.1009669362439155
