CATEGORY	GO_ID	GO_LABEL_FULL	COUNT	PERCENTAGE	P_VALUE	GENES	LIST_TOTAL	POP_HITS	POP_TOTAL	FOLD_ENRICHMENT	BONFERRONI	BENJAMINI	FDR
GOTERM_MF_ALL	GO:0005515	GO:0005515~protein binding	963	80.9924306139613	1.9814570716623356E-20	PID1, TFRC, GMFG, MYLK, TMEM88, DPYSL2, FAM110B, AKT3, VSTM4, GTSE1, PKNOX2, WDHD1, MEF2C, FNBP1, STARD9, UNC5C, SLC5A6, CH25H, CLDN5, RBP7, FEZ1, RBP1, AGTR1, SPARCL1, MYL9, ATF3, ABCB1, PARPBP, CDCA3, CDCA4, CDCA5, ABCB4, GATA6, CDCA7, NCAPG, GATA5, CDCA8, ADAMTS12, IQGAP3, NCAPH, C3, PRKAR2B, PDGFD, PIP5K1B, PPARGC1A, PPARGC1B, GPIHBP1, NGFR, CADM3, TSLP, NR2F1, L1CAM, GRIN2D, IL22RA1, FAM111B, FXYD1, NOSTRIN, DCHS1, FXYD6, FAT4, PKIG, FERMT2, EZH2, GSTM5, SRPX, NCAPG2, PRKAG2, SNX10, PTH1R, RCSD1, AREG, ARHGAP6, OSBPL10, SHE, CHAF1B, JPH2, TPSAB1, ZNF488, CGNL1, DLGAP5, DUSP5, RMI2, KCND3, DUSP1, MAMDC2, EMP1, FOS, WNT9A, EMP3, DUSP8, MMP12, F8, MMP13, KCNMA1, PLSCR4, CDC42EP2, CKS2, PAFAH1B3, CRYAB, RAPGEF3, KANK2, LRRC15, SYNPO2, COL11A1, ODC1, PELI2, CENPA, PTGS1, RECQL4, SPP1, FLNA, DMD, FLNC, JAM2, JAM3, RIC3, CENPW, ATAD5, ATAD2, SAMD4A, BMP8B, TTLL7, CENPE, CENPF, FABP4, CENPH, CENPI, SLMAP, CENPK, CENPL, CENPO, AGRN, LGR6, CDKN3, FAM13C, RASL11A, F13A1, EFEMP1, LEPR, NEK2, MAP3K8, PITX2, KPNA2, PITX1, SYBU, KCNH2, EPM2A, OLFM4, CDC25C, CDC25A, FOXP2, FRMD3, OLFM1, SLC9A7, SLC9A9, ROR1, ROR2, IL6ST, BLM, PFKFB4, KCNE4, TROAP, ECSCR, CREM, DPT, PKMYT1, RAP1GAP, SOCS3, EIF4EBP1, ZNF423, LRRC4B, KL, RBPMS, BDNF, ZBTB16, BMX, CORO2B, NDC80, PTPRD, LRCH2, CXCL12, OGN, LRRK2, ITGB3, FHL1, MCM10, FOXM1, EXO1, BOC, NRG2, PARD3B, HAND2, ITGA8, BIRC5, ITGA7, ITGA5, ST6GALNAC3, PPP1R12B, SLC25A4, DTL, ST6GALNAC6, BIRC3, ITGA9, PRKAA2, C1S, ZBTB47, PCOLCE2, UHRF1, C1R, SRF, NTN1, LRP8, CDC45, FCHO1, TP53INP2, E2F1, CCL2, E2F2, SLC25A23, E2F7, CTHRC1, E2F8, NTRK2, MARCKSL1, DONSON, SYT15, TBX5, SYT11, NOVA1, PRC1, MGP, CD248, RECK, KCNK3, SPON1, MT1M, TONSL, CDC20, RASSF3, RCC1, OXER1, THSD7A, EPHB2, SCN1B, SLC12A8, PAQR8, EPHA7, ANK2, SFRP1, CCDC80, PPP1R3B, KCTD12, KIF20A, EPHA3, RRAD, SDC2, USHBP1, LPAR1, CD1C, PCDH18, BRIP1, RRAS, RACGAP1, TSPAN7, APOD, TSPAN2, KCNN3, A2M, WWTR1, EGR1, EGR2, ST8SIA1, TNFSF12, XRCC2, DCLK2, IGF1, HSPA12A, BRI3BP, IFFO1, ANLN, ID2, PPP1R1B, ID4, CD200, FBXL7, CD22, DIRAS3, PCSK2, CSRNP1, SYNM, DIRAS1, GRIK5, KIF14, BRCA1, PCSK7, KIF11, BRCA2, CHRDL1, KIF15, AKAP12, NCS1, FCER1A, RAC3, CTSG, CD34, LMCD1, LYNX1, KIF24, SORCS1, HBA2, KIF23, ANO5, RGMA, MN1, KIT, DEPDC1, KIF2C, SYNC, TAGLN, SLC43A1, NEXN, CRIP2, STX11, SH3BGRL, RELN, MSX1, GPC6, MICB, CAP2, IL33, GAD1, IL34, PNMA2, PER2, PER1, PER3, MIS18A, CSDC2, CFHR1, KIF26A, KIF26B, TACC3, TACC2, CD69, RAMP1, SPC24, SPC25, MAD2L1, PRDM8, ERCC6L, PRDM6, GIMAP1, BUB1B, CELSR3, NR3C2, RGS5, RGS2, CCND2, PALM, ENPP2, ENPP1, IL6R, TMOD1, PDGFRA, SCARA3, BORA, GEM, PCP4, CCNE2, CCNE1, GPRIN1, DOK6, MASP1, FBN2, GNAZ, NXPH3, NPR2, KLHL13, CACNA1C, ACACB, CACNA1H, CCNB2, CNN1, CCNB1, GRK5, CALD1, RHPN1, ECT2, WNT2, RAI2, UBE2C, CAV1, GGH, DSTN, ISG15, INHBB, INHBA, BMP5, GNAO1, IL6, GNAL, UBE2T, KIF4A, CNTN1, CNTN4, AMOTL1, FGF13, FGF11, SNED1, PODXL2, CNRIP1, ATP2A3, HMGB3, LDB3, LDB2, SOBP, RND3, RERG, TMEM220, LMNB1, GHR, FYCO1, DACT3, MYBL2, CA9, SNTA1, MYOCD, ARHGEF15, PLA2G4C, HUNK, DARS2, IRAK3, ETV4, ACTA2, CCNA2, ACTA1, GREM2, PSRC1, ACOX2, MMRN1, NAV3, CRY2, CHI3L1, IRF5, MS4A2, SCN4B, RBM24, CREB5, LAMA2, CYGB, AURKB, AURKA, PDLIM3, GNG7, ATOH8, SLIT3, SLIT2, CRYM, PDLIM4, PDLIM7, GALNT6, RRM2, EYA4, ATP2B4, S100B, MAPK15, SOD3, ACTC1, COL7A1, POLE2, PTX3, ASB2, FAM50B, CLEC10A, C2ORF88, ADARB1, ABCA12, SLC4A4, RNF112, SOX17, MYC, CREB3L1, MYB, STMN1, BVES, JUNB, GAMT, TSPYL2, NUP210, PRKCB, SERPINF1, SYTL5, DKK1, SOX10, BIN1, DAAM2, MAP1B, MAP1A, FREM1, RNF122, ASF1B, CFH, WDR62, CFP, SKA3, PRKCZ, SKA1, PLAC9, FAM124A, FLRT2, PRDM16, NCKAP1L, ZSCAN18, PLK4, STARD13, FZD2, JUND, FZD7, DNAH14, PLK1, CDC7, CDC6, SLC16A13, NFATC4, POU6F1, FOSL1, EHD2, SQLE, GIPC2, ZNF135, CDKN1C, SERPINA3, MYOM1, BTG2, TGFB1I1, ELN, STON1, TCF21, PYGM, HIF3A, PRSS23, MYOM2, C1QTNF2, CSRP1, ADAMTSL4, C1QTNF6, ADAMTSL3, NUF2, ANXA6, PBK, RBPMS2, RSPO3, TK1, GPRASP1, TIMP4, CEP55, HELLS, TACR1, CIT, ITPKB, ZEB2, ZEB1, PLCB4, TAL1, KIFC1, PLEKHO1, MYZAP, GAS6, JDP2, ANGPTL1, MGLL, GAS7, HBEGF, NFIX, ADCY4, ADCY2, SGMS2, ADCY5, EPCAM, ABI3BP, CKB, RUNX1T1, AOC3, GSN, F10, CCL21, F12, SMOC2, NFIA, NFIB, PLP1, FOSB, C16ORF89, MSRB3, PLCD4, SEMA5B, CSF3, HJURP, FAM107A, FGF2, CLU, SLC8A1, FGF7, TUBB6, ZFP36, TUBB3, CFL2, PHYHD1, OIP5, TLE2, IGFBP5, TPM2, ANKRD44, USP2, TPM1, MAGI2, MITF, HIC1, TRAIP, DISP1, CLIP3, CACNB2, ARMCX1, CACNB4, MELK, RAB37, PGR, TNIK, TOX, FKBP5, RTN4R, PARM1, RNF180, ITPR1, AK4, HMMR, RAD51AP1, KLC3, ORC6, ORC1, BAG2, NACC2, NDN, TPPP, IGFBP6, FANCI, ANKRD29, ATP8B4, ATP8B2, FANCA, CYBRD1, REEP1, RCAN1, LRFN5, NBEA, REEP2, MAFF, BCL2, CDK1, NACAD, CSPG4, DHCR7, NES, SLC26A6, PTTG3P, BNC2, CPQ, COL14A1, LSP1, DNALI1, SYNE1, ADAMTS4, ADAMTS5, CLEC1A, SGCA, ADAMTS1, DNMT3B, EMILIN1, ADAMTS8, PRKG1, GPX3, TRPC1, COBL, ADRA2A, INMT, ASPM, ESPL1, SAPCD2, MCM4, MCM2, HDAC4, ACSS3, CEBPD, CCDC69, FGL2, SEMA3B, SEMA3G, TTK, SEMA3E, FBXL22, SELENBP1, CLEC3B, PLN, DNAJB5, RAB23, MEST, JAZF1, TUB, ANGPT1, SPAG5, PLCL1, SPAG4, KLF4, KLF2, MFAP4, NFASC, KLF6, RAD51, P2RX1, MFAP2, APOC1, PI16, HPSE2, DIXDC1, KLHDC7B, MKI67, ANTXR2, AQP1, EDNRA, EDNRB, RUSC2, RPS6KA2, CHEK1, HABP4, PDK4, CHAC1, SKP2, SYNPO, PTGDS, SOX7, SOX4, TNS1, EBF1, ESCO2, MAPK8IP2, AZGP1, DNA2, ZFPM2, ALDH7A1, SLC22A3, NECAB1, MAOB, TSHZ3, GYPC, STXBP1, PDE1A, TWIST2, STC1, APCDD1, IGSF9, CD79B, FAM43A, STXBP6, SPTBN2, CDT1, DTNA, GADD45B, PDE2A, PYCR1, PARVA, IGFL1, GNG11, ZWINT, TPX2, SMTN, SIM2, ITM2A, TOP2A, RYR2, FEN1, CLIC4, HILPDA, MEOX2, MEOX1, RYR3, CX3CL1, SERP2, GLIPR2, PRX, TNFAIP8L3, PSD, TSC22D1, TSC22D3, TFEB, RHOH, GFRA1, GFRA3, CBFA2T3, RHOB, NAALADL1, CLDN11, CEACAM6, TNNT2, CEACAM5, RHOJ, TFF3, MATN3, MATN2, PTGER4, TNXB, HAAO, IFI6, ZDHHC23, AKAP6, TYMS, CST6, PHYHIP, RASIP1, TCEAL7, NT5E, MTHFD1L, RAD54L, APBB1, SH3BGR, GINS2, SVIL, GINS4, SORBS2, SORBS1, PODN, LYVE1, TPPP3, AXL, DLC1, TRIP13, RAB9B, TPSB2, DSCC1, FAIM2, PTTG1, EME1, NUSAP1, NRCAM, KNTC1, KRT6A, IL11RA, LMO3, HGF, ARID5A, LIFR, ATP1B2, C2ORF15, FANCD2, TIMELESS, COL4A6, MYADM, RELL2, NUPR1, RASL12, KLRB1, LTBP4, FBLN1, ADRB2, FBLN2, COX7A1, LPP, FBLN5, SCUBE1, NLRP3, MYH11, CLSPN, OTX1, LONRF2, ACBD7, BTNL9, CBX7, STIL, CBX6, EPHX2, CBX2, PTCH2, KLHDC1, SMAD9, SSC5D, HSPA2, ESR1, SELE, ARHGAP24, SELP, NR4A2, NR4A1, KIF18A, EFNA3, KIF18B, DLG2, DIAPH3, NR4A3, RADIL, ULBP2, FGFR1, WNT2B, THRA, HSPB6, HSPB8, HSPB7, LMOD1, HSPB2, SIX1, SLC2A3, SLC2A4, CXCL2, CKS1B, TMEM100, TMEM108, BDKRB2, PDE4B, SPEG, AOX1, BDKRB1, PTGIS, PDE4D, ABCC9, MYRIP, KLF15, DCN, TGFBR2, TGFBR3, ARHGAP10, PALLD, COL6A2, CASQ2, PDE5A, COLEC12, COLEC11, HLF, NRXN1, NRXN3, NRXN2, ATP1A2, LTC4S, USP18, NCALD, GNA14, RASD1, POC1A, S1PR1, NCAM1, BUB1, SNCA, POLQ, C2ORF74, NEGR1, HAGHL, NAP1L3, NAP1L2, SHCBP1, NAP1L5, DES, SCD, PPP2R2B, PMP22, SPRY1, RGS11	1117	14225	18869	1.143588352557456	3.146553829799789E-17	3.146553829799789E-17	2.982092892851815E-17
GOTERM_MF_ALL	GO:0008092	GO:0008092~cytoskeletal protein binding	133	11.185870479394449	1.443661324025623E-17	GMFG, FAM107A, DIXDC1, CLU, SLC8A1, MYLK, RGS2, DPYSL2, CFL2, STMN1, NUSAP1, NRCAM, SYNPO, GTSE1, SYBU, PKNOX2, TNS1, TMOD1, TPM2, TPM1, STARD9, ANK2, UNC5C, MAPK8IP2, CLIP3, FRMD3, CACNB2, BIN1, DAAM2, MAP1B, FEZ1, MAP1A, KIF20A, MYL9, CACNA1C, IQGAP3, SKA1, CNN1, KLC3, BAG2, RACGAP1, CALD1, NDN, MYH11, TPPP, PPARGC1A, SPTBN2, PLK1, DSTN, DCLK2, PARVA, HSPA2, CORO2B, REEP1, ANLN, TPX2, KIF18A, SMTN, DIAPH3, KIF18B, KIF4A, REEP2, FGF13, FERMT2, MYOM1, SYNM, LRRK2, HSPB7, KIF14, LMOD1, LDB3, BRCA1, LSP1, KIF11, RCSD1, BRCA2, MYOM2, SYNE1, KIF15, CSRP1, PDE4B, ANXA6, DLGAP5, SNTA1, KIF24, COBL, KIF23, MYRIP, ACTA1, PSRC1, NAV3, PALLD, KIFC1, TNNT2, KCNMA1, BIRC5, KIF2C, CRYAB, GAS7, TAGLN, CCDC69, SYNPO2, NEXN, LRP8, NCALD, PDLIM3, FLNA, DMD, FLNC, APBB1, PDLIM4, PDLIM7, SNCA, CAP2, SVIL, MARCKSL1, GSN, SPAG5, SORBS2, SORBS1, S100B, TTLL7, CENPE, CENPF, TPPP3, ACTC1, DES, KIF26A, AXL, PRC1, SYT11, KIF26B, SPC24	1117	1039	18869	2.1623789488377625	2.292534182552689E-14	1.1462670912763446E-14	1.0863551463292813E-14
GOTERM_MF_ALL	GO:0005201	GO:0005201~extracellular matrix structural constituent	39	3.280067283431455	7.485266119168798E-13	FBN2, SRPX, SPON1, TNXB, LAMA2, COL14A1, COL11A1, ELN, FGL2, LTBP4, DPT, FBLN1, PRELP, FBLN2, THSD4, FBLN5, EFEMP1, ABI3BP, EMILIN1, CTHRC1, TFPI2, PODN, DCN, MFAP5, MFAP4, MMRN1, CILP, COL4A4, COL6A2, COL7A1, MFAP2, MGP, OGN, COL4A6, CHI3L1, COL21A1, AGRN, MATN3, MATN2	1117	170	18869	3.8753541524040234	1.1886376327652215E-9	3.962200865746684E-10	3.755108503116347E-10
GOTERM_MF_ALL	GO:0097367	GO:0097367~carbohydrate derivative binding	211	17.74600504625736	1.6219212053661667E-10	HPSE2, ABCA12, MKI67, MYLK, RNF112, RPS6KA2, CHEK1, AKT3, PDK4, EPHB2, BVES, GBP6, EPHA7, PRKCB, STARD9, SFRP1, CCDC80, CRISPLD2, DNA2, KIF20A, EPHA3, PIF1, ABCB1, CFH, RRAD, ABCB4, LPAR1, CD1C, PRKCZ, TRPM2, ADAMTS15, BRIP1, RRAS, PRKAR2B, PIP5K1B, SLC19A1, PLK4, ABCA6, XRCC2, PDE2A, DNAH14, PLK1, ABCA9, DCLK2, CDC7, ABCA8, CDC6, HSPA12A, DCLK1, EHD2, CD22, DIRAS3, TOP2A, DIRAS1, KIF14, PRKAG2, KIF11, KIF15, PBK, ANXA6, RAC3, RSPO3, CTSG, TK1, HELLS, KIF24, RHOH, KIF23, CIT, RHOB, ITPKB, KIFC1, CEACAM5, RHOJ, KIT, PLSCR4, KIF2C, RAPGEF3, HBEGF, POPDC2, TNXB, COL11A1, ADCY4, ADCY2, ADCY5, RECQL4, MTHFD1L, ABI3BP, RAD54L, DMD, CKB, ATAD5, ATAD2, LYVE1, TTLL7, CENPE, SMOC2, KIF26A, AXL, KIF26B, TRIP13, LGR6, AGRN, RAB9B, DGKG, ERCC6L, GIMAP1, RASL11A, BUB1B, FGF2, ACTG2, TUBB6, FGF7, TUBB3, ENPP1, NEK2, MAP3K8, STK32B, PDGFRA, GEM, CLIP3, MELK, RAB37, ROR1, TNIK, ROR2, RTN4R, RASL12, GNAZ, PFKFB4, BLM, PKDCC, NPR1, NPR2, LTBP4, AK4, HMMR, PKMYT1, ACACB, GRK5, ORC1, NLRP3, MYH11, ATP8B4, ATP8B2, UBE2C, HSPA2, BMX, SELE, GNAO1, SELP, KIF18A, GNAL, KIF18B, KIF4A, UBE2T, CDK1, FGFR1, PODXL2, LRRK2, ATP2A3, RND3, RERG, ADAMTS5, ADAMTS1, PDE4B, SPEG, ADAMTS8, PRKG1, PDE4D, HUNK, DARS2, ABCC9, IRAK3, DCN, TGFBR2, ACTA2, TGFBR3, ACTA1, GREM2, NAV3, MCM4, CHI3L1, PDE5A, MCM2, ACSS3, PRKAA2, PCOLCE2, TTK, NDNF, PRELP, ATP1A2, AURKB, AURKA, GNA14, CLEC3B, RASD1, RAB23, SLIT3, SLIT2, BUB1, NTRK2, POLQ, ATP2B4, MAPK15, SOD3, MFAP4, ACTC1, SBK1, RAD51, P2RX1	1117	2340	18869	1.52321886310248	2.5756109878205535E-7	6.439027185303682E-8	6.102478535190201E-8
GOTERM_MF_ALL	GO:0015631	GO:0015631~tubulin binding	58	4.878048780487805	3.6331426624973713E-10	LRRK2, KIF14, DIXDC1, BRCA1, KIF11, BRCA2, KIF15, RGS2, DPYSL2, STMN1, NUSAP1, PDE4B, GTSE1, DLGAP5, SYBU, STARD9, KIF24, KIF23, UNC5C, CLIP3, PSRC1, NAV3, KIFC1, MAP1B, FEZ1, MAP1A, BIRC5, KIF2C, KIF20A, CRYAB, CCDC69, NCALD, SKA1, KLC3, RACGAP1, NDN, TPPP, PPARGC1A, SNCA, SPAG5, PLK1, DCLK2, REEP1, TTLL7, CENPE, TPX2, KIF18A, CENPF, TPPP3, KIF18B, SYT11, KIF26A, PRC1, KIF26B, KIF4A, REEP2, FGF13, SPC24	1117	395	18869	2.480427909295922	5.769428905733065E-7	1.1538861096091652E-7	1.0935759414117088E-7
GOTERM_MF_ALL	GO:0043168	GO:0043168~anion binding	250	21.026072329688812	2.370966766962851E-9	HPSE2, ABCA12, MKI67, MYLK, RNF112, RPS6KA2, CHEK1, AKT3, PDK4, RCC1, OXER1, EPHB2, PTGDS, BVES, GBP6, EPHA7, PRKCB, STARD9, SYTL5, RBP7, SFRP1, CCDC80, CRISPLD2, BIN1, MAP1B, RBP1, DNA2, KIF20A, EPHA3, PIF1, ABCB1, CFH, MAOB, RRAD, ABCB4, LPAR1, PRKCZ, TRPM2, ADAMTS15, BRIP1, RRAS, RACGAP1, PRKAR2B, PIP5K1B, STXBP6, SLC19A1, SPTBN2, PLK4, ABCA6, FZD7, XRCC2, PDE2A, DNAH14, PLK1, ABCA9, DCLK2, CDC7, ABCA8, CDC6, HSPA12A, DCLK1, GRIN2D, SQLE, EHD2, FERMT2, CD22, DIRAS3, TOP2A, DIRAS1, KIF14, PRKAG2, SNX10, PYGM, KIF11, KIF15, OSBPL10, JPH2, PBK, ANXA6, RAC3, RSPO3, TNFAIP8L3, CTSG, TK1, CD34, PSD, HELLS, KIF24, RHOH, KIF23, CIT, RHOB, ITPKB, KIFC1, CEACAM5, RHOJ, KIT, PLSCR4, KIF2C, GAS6, RAPGEF3, HBEGF, POPDC2, TNXB, COL11A1, ADCY4, ADCY2, TYMS, ADCY5, RECQL4, MTHFD1L, ABI3BP, RAD54L, CKB, SVIL, GSN, ATAD5, F10, GAD1, ATAD2, TTLL7, CENPE, SMOC2, FABP4, KIF26A, AXL, FABP6, KIF26B, TRIP13, LGR6, AGRN, RAB9B, DGKG, ERCC6L, STEAP4, GIMAP1, RASL11A, BUB1B, FGF2, ACTG2, TUBB6, FGF7, TUBB3, ENPP1, NEK2, MAP3K8, STK32B, PDGFRA, GEM, MELK, RAB37, ROR1, TNIK, ROR2, RTN4R, RASL12, GNAZ, PFKFB4, BLM, PKDCC, NPR1, NPR2, ITPR1, AK4, RASAL1, PKMYT1, ACACB, GRK5, ORC1, NLRP3, MYH11, ACBD7, ATP8B4, ATP8B2, UBE2C, HSPA2, BMX, SELE, GNAO1, SELP, KIF18A, GNAL, KIF18B, KIF4A, UBE2T, CDK1, FGFR1, LRRK2, ATP2A3, RND3, RERG, ADAMTS5, ADAMTS1, PDE4B, SPEG, AOX1, ADAMTS8, PRKG1, PDE4D, TRPC1, PLA2G4C, HUNK, DARS2, ABCC9, IRAK3, PARD3B, TGFBR2, ACTA2, TGFBR3, ACTA1, GREM2, ACOX2, NAV3, CRY2, MCM4, PDE5A, MCM2, ACSS3, PRKAA2, PCOLCE2, TTK, NDNF, PRELP, ATP1A2, AURKB, AURKA, GNA14, CLEC3B, RASD1, RAB23, SLIT3, SLIT2, BUB1, SNCA, NTRK2, POLQ, PLCL1, PLA2G2A, ATP2B4, SYT15, MAPK15, SOD3, ACTC1, SBK1, RAD51, SYT11, P2RX1, APOC1, NAGS, FOLR2	1117	2980	18869	1.4171618609290224	3.765088125495808E-6	6.275158709895012E-7	5.947174973798485E-7
GOTERM_MF_ALL	GO:0032403	GO:0032403~protein complex binding	85	7.1488645920941964	6.6084054042182924E-9	MYOM1, SYNM, COL14A1, LRRK2, GMFG, ITGB3, RCSD1, FGF2, MYOM2, CX3CL1, SYNE1, CDC20, ADAMTS5, CFL2, ANXA6, FCER1A, ENPP1, EMILIN1, ADAMTS8, PKNOX2, TMOD1, TPM2, TPM1, GFRA1, ADRA2A, DCN, TGFBR2, TGFBR3, MMP12, CACNB2, MMP13, BIN1, COL6A2, ITGA8, SPARCL1, ITGA7, RELL2, ITGA5, MS4A2, GAS7, ITGA9, GNAZ, LRRC15, TAGLN, TNXB, PCOLCE2, LTBP4, NEXN, FBLN1, TTK, IQGAP3, FBLN5, GNA14, FCHO1, ABI3BP, SPP1, FLNA, MYH11, DMD, NCKAP1L, FLNC, CLSPN, JAM2, SPTBN2, SNCA, JAM3, SVIL, MARCKSL1, GSN, PLK1, DSTN, ISG15, IGF1, SORBS1, PODN, CORO2B, GNAO1, CENPE, CENPF, GNAL, CXCL12, CENPH, NES, CD22, FERMT2	1117	742	18869	1.9351326111769347	1.0494092712365344E-5	1.4868877513510611E-6	1.409172585505886E-6
GOTERM_MF_ALL	GO:0008017	GO:0008017~microtubule binding	44	3.700588730025231	8.259957582147453E-9	CCDC69, LRRK2, KIF14, KIF11, SKA1, KIF15, KLC3, RACGAP1, DPYSL2, NUSAP1, TPPP, GTSE1, SYBU, DLGAP5, SNCA, SPAG5, PLK1, STARD9, DCLK2, KIF24, KIF23, CLIP3, REEP1, CENPE, TPX2, KIF18A, CENPF, KIF18B, PSRC1, NAV3, PRC1, KIF26A, KIFC1, KIF4A, MAP1B, KIF26B, MAP1A, REEP2, BIRC5, KIF2C, KIF20A, FGF13, CRYAB, SPC24	1117	280	18869	2.6545466172144776	1.3116726708783943E-5	1.4868877513510611E-6	1.409172585505886E-6
GOTERM_MF_ALL	GO:0003779	GO:0003779~actin binding	61	5.130361648444071	8.426945694055132E-9	MYOM1, LRRK2, GMFG, FAM107A, LMOD1, DIXDC1, LDB3, LSP1, RCSD1, MYOM2, MYLK, SYNE1, CFL2, ANXA6, SYNPO, PKNOX2, TNS1, SNTA1, TMOD1, TPM2, TPM1, COBL, MYRIP, CACNB2, BIN1, DAAM2, PALLD, MAP1B, TNNT2, MAP1A, KCNMA1, GAS7, TAGLN, SYNPO2, NEXN, IQGAP3, NCALD, CNN1, PDLIM3, CALD1, FLNA, MYH11, DMD, FLNC, PDLIM4, PDLIM7, SPTBN2, SNCA, CAP2, SVIL, MARCKSL1, GSN, DSTN, PARVA, SORBS1, CORO2B, ANLN, KIF18A, SMTN, DIAPH3, FERMT2	1117	463	18869	2.2255868948568267	1.3381900284437087E-5	1.4868877513510611E-6	1.409172585505886E-6
GOTERM_MF_ALL	GO:0005488	GO:0005488~binding	1059	89.06644238856181	1.8970784488592492E-8	PID1, TFRC, GMFG, MYLK, ZDBF2, TMEM88, ZC3H12B, DPYSL2, FAM110B, AKT3, VSTM4, GTSE1, PKNOX2, GBP6, WDHD1, MEF2C, RBFOX3, FNBP1, CACNA2D1, STARD8, STARD9, UNC5C, RNASE4, SLC5A6, CH25H, CLDN5, RBP7, FEZ1, RBP1, AGTR1, SPARCL1, MYL9, ATF3, PADI1, PIF1, ABCB1, PARPBP, CDCA3, CDCA4, CDCA5, ABCB4, GATA6, CDCA7, NCAPG, GATA5, CDCA8, ADAMTS12, IQGAP3, NCAPH, C3, ADAMTS15, PRKAR2B, PDGFD, PIP5K1B, PPARGC1A, PPARGC1B, GPIHBP1, NGFR, CADM3, TSLP, ABCA6, ABCA9, NR2F1, ABCA8, L1CAM, GRIN2D, IL22RA1, FAM111B, FXYD1, NOSTRIN, DCHS1, FXYD6, FAT4, PKIG, FERMT2, EZH2, GSTM5, SRPX, NCAPG2, PRKAG2, SNX10, PTH1R, RCSD1, AREG, ARHGAP6, OSBPL10, SHE, CHAF1B, JPH2, TPSAB1, ZNF488, CGNL1, DLGAP5, DUSP5, RMI2, KCND3, DUSP1, MAMDC2, EMP1, FOS, WNT9A, EMP3, DUSP8, MMP12, MMP11, F8, MMP13, KCNMA1, PLSCR4, CDC42EP2, CKS2, PAFAH1B3, CRYAB, RAPGEF3, KANK2, LRRC15, ZNF471, SYNPO2, COL11A1, ODC1, PELI2, CENPA, PTGS1, RECQL4, SPP1, FLNA, DMD, FLNC, JAM2, JAM3, RIC3, CENPW, ATAD5, ATAD2, ADAM33, SAMD4A, BMP8B, TTLL7, CENPE, CENPF, FABP4, CENPH, FABP6, CENPI, SLMAP, CENPK, CENPL, CENPO, AGRN, LGR6, LIMS2, CDKN3, FAM13C, RASL11A, F13A1, EFEMP1, LEPR, NEK2, MAP3K8, PITX2, KPNA2, PITX1, SYBU, CPA3, KCNH2, EPM2A, OLFM4, CDC25C, CDC25A, FOXP2, FRMD3, OLFM1, SLC9A7, SLC9A9, ROR1, ROR2, IL6ST, ZNF671, BLM, PFKFB4, RNASEH2A, KCNE4, TROAP, ECSCR, CREM, DPT, PKMYT1, RAP1GAP, SOCS3, EIF4EBP1, NPTX1, ZNF423, LRRC4B, KL, RBPMS, BDNF, ZBTB16, BMX, CORO2B, NDC80, PTPRD, LRCH2, CXCL12, OGN, LRRK2, CELF2, ITGB3, FHL1, MCM10, ECE2, FOXM1, EXO1, BOC, PGM5, PEG3, NRG2, PARD3B, HAND2, ITGA8, BIRC5, ITGA7, ITGA5, ST6GALNAC3, PPP1R12B, SLC25A4, DTL, ST6GALNAC6, BIRC3, ITGA9, PRKAA2, C1S, ZBTB47, PCOLCE2, UHRF1, C1R, SRF, NTN1, LRP8, CDC45, FCHO1, TP53INP2, E2F1, CCL2, E2F2, SLC25A23, SLC25A25, E2F7, CTHRC1, E2F8, NTRK2, MARCKSL1, PCDH7, DONSON, SYT15, TBX5, SYT11, NOVA1, PRC1, MGP, CD248, PABPC1L, NAGS, RECK, KCNK3, SPON1, MT1M, TONSL, CDC20, RASSF3, RCC1, OXER1, THSD7A, EPHB2, SCN1B, SLC12A8, PAQR8, EPHA7, ANK2, CYP39A1, SFRP1, CCDC80, CRISPLD2, PPP1R3B, KCTD12, KIF20A, EPHA3, RRAD, SDC2, USHBP1, LPAR1, PCDH19, CD1C, PCDH18, BRIP1, RRAS, RACGAP1, TSPAN7, APOD, TSPAN2, KCNN3, A2M, WWTR1, EGR1, EGR2, EGR3, FOXF1, ST8SIA1, TNFSF12, ADHFE1, XRCC2, DCLK2, IGF1, HSPA12A, BRI3BP, DCLK1, IFFO1, ANLN, ID2, PPP1R1B, ID4, CD200, FBXL7, CD22, DIRAS3, PCSK2, CSRNP1, SYNM, DIRAS1, GRIK5, KIF14, BRCA1, PCSK7, KIF11, BRCA2, CHRDL1, KIF15, AKAP12, NCS1, FCER1A, RAC3, CTSG, CD34, LMCD1, LYNX1, KIF24, SORCS1, HBA2, KIF23, ANO5, RGMA, MN1, TOX2, KIT, DEPDC1, KIF2C, SYNC, PDZRN3, PDZRN4, POPDC2, TAGLN, SLC43A1, PRICKLE2, NEXN, CRIP2, STX11, SH3BGRL, RELN, MSX1, GPC6, MICB, CAP2, IL33, GAD1, IL34, PNMA2, PER2, PER1, PER3, MIS18A, CSDC2, CFHR1, KIF26A, KIF26B, TACC3, TACC2, CD69, RAMP1, SPC24, SPC25, ZFP28, MAD2L1, PRDM8, ERCC6L, PRDM6, GIMAP1, BUB1B, ACTG2, CELSR3, NR3C2, RGS5, RGS2, CCND2, PALM, ENPP2, ENPP1, PAMR1, IL6R, TMOD1, PDGFRA, SCARA3, BORA, GEM, PCP4, CCNE2, CCNE1, GPRIN1, DOK6, MASP1, FBN2, GNAZ, PKDCC, NPR1, NXPH3, NPR2, KLHL13, CACNA1C, RASGRP2, ACACB, CACNA1H, CCNB2, CNN1, CCNB1, GRK5, CALD1, RHPN1, ECT2, WNT2, RAI2, UBE2C, CAV1, GGH, DSTN, ISG15, INHBB, INHBA, BMP5, GNAO1, IL6, GNAL, UBE2T, KIF4A, CNTN1, CNTN4, AMOTL1, FGF13, FGF11, SNED1, PODXL2, CPXM2, CNRIP1, ATP2A3, HMGB3, LDB3, LDB2, SOBP, AFF3, RND3, RERG, TMEM220, LMNB1, GHR, FYCO1, DACT3, MYBL2, CA9, SNTA1, MYOCD, ARHGEF15, MMP1, PLA2G4C, HUNK, DARS2, IRAK3, ETV4, ACTA2, CCNA2, ACTA1, GREM2, PSRC1, ACOX2, MMRN1, NAV3, CRY2, CHI3L1, IRF5, MS4A2, SCN4B, RBM24, CREB5, LAMA2, CYGB, AURKB, AURKA, PDLIM3, GNG7, ATOH8, SLIT3, SLIT2, CRYM, PDLIM4, PDLIM7, GALNT6, RRM2, EYA4, PLA2G2A, ATP2B4, S100B, MAPK15, SOD3, ACTC1, SBK1, COL7A1, POLE2, PTX3, ASB2, FAM50B, CLEC10A, C2ORF88, ADARB1, ABCA12, SLC4A4, RNF112, SOX17, MYC, CREB3L1, MYB, STMN1, BVES, JUNB, GAMT, TSPYL2, NUP210, PRKCB, SERPINF1, SYTL5, DKK1, SOX10, BIN1, DAAM2, MAP1B, MAP1A, FREM1, RNF122, ASF1B, CFH, WDR62, CFP, SKA3, PRKCZ, SKA1, PLAC9, FAM124A, FLRT2, PRDM16, NCKAP1L, SLC19A1, ZSCAN18, PLK4, STARD13, FZD2, JUND, FZD7, DNAH14, PLK1, CDC7, CDC6, SLC16A13, NFATC4, POU6F1, FOSL1, EHD2, SQLE, MEX3A, GPR183, GIPC2, CPEB2, ZNF135, CDKN1C, SERPINA3, MYOM1, BTG2, TGFB1I1, ELN, STON1, TCF21, PYGM, HIF3A, PRSS23, MYOM2, C1QTNF2, CSRP1, ADAMTSL4, C1QTNF6, ADAMTSL3, NUF2, ANXA6, PBK, RBPMS2, RSPO3, RNF150, TK1, GPRASP1, TIMP4, CEP55, HELLS, TACR1, CIT, ITPKB, ZEB2, ZEB1, PLCB4, TAL1, KIFC1, RGN, PLEKHO1, MYZAP, GAS6, JDP2, ANGPTL1, MGLL, GAS7, HBEGF, NFIX, PRUNE2, ADCY4, ADCY2, SGMS2, APOLD1, ADCY5, EPCAM, ABI3BP, CKB, RUNX1T1, AOC3, GSN, F10, CCL21, F12, SMOC2, NFIA, NFIB, PLP1, FOSB, C16ORF89, MSRB3, PLCD4, ZNF331, DGKG, SEMA5B, CSF3, HJURP, FAM107A, FGF2, CLU, SLC8A1, FGF7, TUBB6, ZFP36, TUBB3, CFL2, PHYHD1, OIP5, STK32B, CSGALNACT1, TLE2, IGFBP5, TPM2, ANKRD44, USP2, TPM1, MAGI2, MITF, HIC1, TRAIP, DISP1, CLIP3, CACNB2, ARMCX1, CACNB4, MELK, RAB37, PGR, TNIK, TOX, FKBP5, RTN4R, PARM1, RNF180, ITPR1, AK4, RASAL1, HMMR, RAD51AP1, KLC3, ORC6, ORC1, BAG2, NACC2, NDN, TPPP, IGFBP6, FANCI, ANKRD29, ATP8B4, ATP8B2, FANCA, CYBRD1, REEP1, RCAN1, LRFN5, NBEA, RCAN2, REEP2, MAFF, BCL2, CDK1, NACAD, CSPG4, DHCR7, NES, SLC26A6, PTTG3P, BNC2, CPQ, COL14A1, LSP1, DNALI1, SYNE1, SGCE, ADAMTS4, ADAMTS5, CLEC1A, SGCA, ADAMTS1, DNMT3B, EMILIN1, ADAMTS8, ADAMTS9, PRKG1, GPX3, TRPC1, COBL, ADRA2A, INMT, ASPM, ESPL1, SAPCD2, MCM4, SMPDL3B, MCM2, HDAC4, ACSS3, CEBPD, CCDC69, FGL2, SEMA3B, SEMA3G, TTK, SEMA3E, NDNF, FBXL22, SELENBP1, CLEC3B, PLN, DNAJB5, RAB23, BCO2, MEST, JAZF1, TUB, ANGPT1, SPAG5, PLCL1, SPAG4, KLF4, KLF2, MFAP4, NFASC, KLF6, RAD51, P2RX1, MFAP2, APOC1, KLF9, TLL1, PI16, FOLR2, CDO1, VIPR2, HPSE2, DIXDC1, KLHDC7B, MKI67, ANTXR2, AQP1, EDNRA, EDNRB, RUSC2, RPS6KA2, CHEK1, HABP4, PDK4, CHAC1, SKP2, SYNPO, PTGDS, SOX7, SOX4, TNS1, EBF1, EBF3, ESCO2, MAPK8IP2, CYP27A1, AZGP1, DNA2, ZFPM2, ALDH7A1, SLC22A3, NECAB1, MAOB, TSHZ3, GYPC, STXBP1, PDE1A, TWIST2, STC1, APCDD1, IGSF9, CD79B, TRPM2, FAM43A, STXBP6, SPTBN2, CDT1, DTNA, GADD45B, PDE2A, PYCR1, PARVA, IGFL1, GNG11, ZWINT, TPX2, SMTN, SIM2, ITM2A, TOP2A, RYR2, FEN1, CLIC4, HILPDA, MEOX2, MEOX1, RYR3, CX3CL1, SERP2, GLIPR2, PRX, TNFAIP8L3, ZCCHC24, PSD, TSC22D1, BHMT2, TSC22D3, TFEB, RHOH, GFRA1, GFRA3, CBFA2T3, RHOB, NAALADL1, CLDN11, CEACAM6, TNNT2, CEACAM5, RHOJ, TFF3, MATN3, MATN2, PTGER4, TNXB, ADH1C, ADH1B, HAAO, IFI6, ZDHHC23, AKAP6, TYMS, CST6, PHYHIP, RASIP1, TCEAL7, NT5E, MTHFD1L, RAD54L, APBB1, SH3BGR, GINS2, SVIL, GINS4, SORBS2, SORBS1, PODN, LYVE1, TPPP3, AXL, DLC1, TRIP13, RAB9B, TPSB2, STEAP4, DSCC1, FAIM2, PTTG1, EME1, NUSAP1, SVEP1, NRCAM, KNTC1, KRT6A, IL11RA, LMO3, HGF, ARID5A, LIFR, ATP1B2, C2ORF15, EMCN, FANCD2, COL4A4, TIMELESS, COL4A6, MYADM, RELL2, NUPR1, RASL12, KLRB1, LTBP4, FBLN1, ADRB2, FBLN2, COX7A1, LPP, FBLN5, SCUBE1, NLRP3, MYH11, CLSPN, OTX1, LONRF2, ACBD7, BTNL9, CBX7, STIL, CBX6, EPHX2, CBX2, PTCH2, KLHDC1, SMAD9, SSC5D, HSPA2, ESR1, SELE, ARHGAP24, SELP, NR4A2, NR4A1, KIF18A, EFNA3, KIF18B, DLG2, DIAPH3, NR4A3, RADIL, ULBP2, FGFR1, PCDHGB7, WNT2B, THRA, HSPB6, HSPB8, HSPB7, LMOD1, HSPB2, SIX1, SLC2A3, SLC2A4, CXCL2, CKS1B, TMEM100, ALDH2, SIX4, HEPH, TMEM108, BDKRB2, PDE4B, SPEG, AOX1, BDKRB1, PTGIS, PDE4D, ABCC9, MYRIP, KLF15, DCN, TGFBR2, TGFBR3, ARHGAP10, PALLD, COL6A2, CASQ2, PDE5A, RBMS3, COLEC12, COLEC11, HLF, NRXN1, NRXN3, NRXN2, ATP1A2, PRELP, LTC4S, USP18, NCALD, GNA14, RASD1, POC1A, S1PR1, NCAM1, BUB1, SNCA, POLQ, C2ORF74, NEGR1, HAGHL, NAP1L3, NAP1L2, SHCBP1, NAP1L5, DES, SCD, XPNPEP2, PPP2R2B, PMP22, SPRY1, PDE7B, RGS11	1117	17056	18869	1.04885266040268	3.012515229838808E-5	3.012560576788488E-6	2.85510306553317E-6
GOTERM_MF_ALL	GO:0005102	GO:0005102~receptor binding	160	13.45668629100084	2.8600481409934862E-8	SEMA5B, CSF3, GMFG, ABCA12, CLU, FGF2, AQP1, FGF7, EDNRB, EFEMP1, TUBB3, PALM, ENPP1, CHAC1, EPHB2, IL6R, PDGFRA, EPHA7, PRKCB, HGF, MAGI2, ARID5A, LIFR, SYTL5, DKK1, FOXP2, SFRP1, AGTR1, PGR, ROR2, IL6ST, GNAZ, NXPH3, LTBP4, STC1, FBLN1, FBLN5, C3, CCNB1, FLRT2, PDGFD, IGFBP6, A2M, WNT2, PPARGC1A, PPARGC1B, LRRC4B, BTNL9, KL, JUND, TSLP, BDNF, TNFSF12, CAV1, FZD7, PTCH2, INHBB, ISG15, INHBA, IGFL1, IGF1, ESR1, BMP5, NFATC4, REEP1, NR4A2, PTPRD, GNAO1, NR4A1, EFNA3, IL6, NR4A3, GNAL, CXCL12, OGN, REEP2, PPP1R1B, ULBP2, FGF13, NES, CD22, FGF11, FERMT2, FGFR1, SNED1, WNT2B, CNRIP1, ITGB3, TGFB1I1, HILPDA, TCF21, CXCL2, AREG, RERG, CX3CL1, ADAMTS5, BDKRB2, RSPO3, EMILIN1, CTSG, ADAMTS8, LYNX1, PDE4D, TRPC1, GFRA1, WNT9A, NRG2, GFRA3, ADRA2A, RGMA, TGFBR2, TGFBR3, GREM2, PLSCR4, CRY2, ITGA8, CDC42EP2, ITGA7, ITGA5, GAS6, ANGPTL1, HBEGF, ITGA9, TNXB, LAMA2, NRXN1, FGL2, SEMA3B, SEMA3G, NRXN3, NRXN2, SEMA3E, GNA14, RELN, SPP1, S1PR1, FLNA, CCL2, SLIT3, DMD, APBB1, SLIT2, JAM2, MICB, CTHRC1, JAM3, TUB, IL33, RIC3, ANGPT1, CCL21, IL34, PLCL1, BMP8B, SORBS1, S100B, MFAP4, FABP4, TACC2, LGR6	1117	1761	18869	1.5348160710754295	4.5416533794528924E-5	4.128869498088779E-6	3.913065865631997E-6
GOTERM_MF_ALL	GO:0005539	GO:0005539~glycosaminoglycan binding	39	3.280067283431455	3.7060512793991843E-8	RTN4R, TNXB, CFH, PODXL2, PCOLCE2, COL11A1, LTBP4, NDNF, PRELP, HMMR, FGF2, ADAMTS15, ADAMTS5, FGF7, CLEC3B, ADAMTS1, ABI3BP, ANXA6, RSPO3, NLRP3, CTSG, SLIT3, SLIT2, ADAMTS8, LYVE1, SOD3, DCN, TGFBR2, SELP, TGFBR3, GREM2, SMOC2, SFRP1, CCDC80, CRISPLD2, LGR6, AGRN, FGFR1, HBEGF	1117	243	18869	2.711153110735325	5.8850363618301316E-5	4.9043411930715874E-6	4.64800597957981E-6
GOTERM_MF_ALL	GO:0042802	GO:0042802~identical protein binding	187	15.727502102607232	1.173282219728865E-7	TFRC, PRDM6, HJURP, ADARB1, FGF2, SLC4A4, AQP1, RASSF3, DPYSL2, LEPR, ENPP1, OIP5, EPHB2, SKP2, PITX2, IL6R, EPM2A, KCNH2, PDGFRA, FNBP1, TPM2, HGF, TPM1, USP2, ARID5A, SOX10, FOXP2, TRAIP, CLDN5, SFRP1, BIN1, TIMELESS, PGR, KCTD12, MASP1, IL6ST, ALDH7A1, ATF3, NECAB1, BLM, CFH, MAOB, NPR2, STXBP1, SDC2, STC1, FBLN1, ADRB2, APCDD1, ACACB, FBLN5, RAP1GAP, CD79B, SCUBE1, BAG2, NACC2, NLRP3, TPPP, IGFBP6, A2M, ECT2, PLK4, WWTR1, CADM3, STIL, RBPMS, EPHX2, ZBTB16, CAV1, PDE2A, PLK1, CYBRD1, PYCR1, INHBB, INHBA, ESR1, NDC80, RCAN1, NR4A1, EHD2, NR4A3, GIPC2, BCL2, AMOTL1, SLC26A6, GSTM5, FGFR1, TOP2A, MYOM1, RYR2, HSPB6, CPQ, LRRK2, GRIK5, ITGB3, HSPB8, MCM10, PTH1R, BRCA2, SYNE1, GHR, GLIPR2, ADAMTSL4, C1QTNF6, ANXA6, RBPMS2, AOX1, DACT3, EMILIN1, TK1, TPSAB1, CEP55, PRKG1, GPX3, KIF24, DARS2, IRAK3, FOS, ADRA2A, NAALADL1, CLDN11, GREM2, ACOX2, CEACAM6, CEACAM5, TNNT2, HAND2, KCNMA1, KIT, CASQ2, TFF3, BIRC5, IRF5, CRYAB, PAFAH1B3, JDP2, MGLL, GAS7, CREB5, HDAC4, COLEC11, CEBPD, C1S, UHRF1, C1R, SRF, ODC1, TTK, TYMS, LTC4S, RASIP1, PLN, MTHFD1L, FLNA, FLNC, SLIT2, CRYM, PDLIM4, E2F7, E2F8, SNCA, JAM3, CAP2, AOC3, NTRK2, POLQ, RRM2, ANGPT1, IL34, GAD1, SORBS2, S100B, CENPF, RAD51, MIS18A, DES, CFHR1, PRC1, SYT11, P2RX1, PLP1, C16ORF89, PTX3, TRIP13, CD69, RAB9B, MAD2L1	1117	2186	18869	1.4450642609721998	1.862998715319586E-4	1.433209357638029E-5	1.3582998005322631E-5
