CATEGORY	GO_ID	GO_LABEL_FULL	COUNT	PERCENTAGE	P_VALUE	GENES	LIST_TOTAL	POP_HITS	POP_TOTAL	FOLD_ENRICHMENT	BONFERRONI	BENJAMINI	FDR
GOTERM_MF_ALL	GO:0050840	GO:0050840~extracellular matrix binding	17	1.4297729184188395	2.548279183858098E-7	LRRC15, ITGB3, COL11A1, ELN, SSC5D, FBLN2, DCN, ADAMTS15, ADAMTS5, SMOC2, SPP1, SPARCL1, ITGA7, CD248, SLIT2, AGRN, ITGA9	1117	60	18869	4.786227991644285	4.045849194717066E-4	2.8904766742618994E-5	2.7394001226474552E-5
GOTERM_MF_ALL	GO:0043167	GO:0043167~ion binding	466	39.19259882253995	4.835854330725464E-7	ADARB1, ABCA12, MYLK, ZDBF2, RNF112, ZC3H12B, AKT3, JUNB, BVES, GBP6, PRKCB, CACNA2D1, STARD9, SYTL5, RBP7, CH25H, BIN1, MAP1B, RBP1, SPARCL1, MYL9, FREM1, PADI1, RNF122, PIF1, ABCB1, CFH, ABCB4, GATA6, GATA5, ADAMTS12, PRKCZ, ADAMTS15, PRKAR2B, PRDM16, PIP5K1B, SLC19A1, ZSCAN18, PLK4, ABCA6, FZD7, PLK1, DNAH14, ABCA9, NR2F1, CDC7, ABCA8, CDC6, GRIN2D, EHD2, SQLE, MEX3A, DCHS1, FAT4, ZNF135, FERMT2, TGFB1I1, PRKAG2, SNX10, PYGM, OSBPL10, JPH2, CSRP1, ANXA6, PBK, RSPO3, RNF150, TK1, ZNF488, TIMP4, HELLS, KCND3, CIT, MMP12, ITPKB, MMP11, F8, ZEB2, PLCB4, MMP13, ZEB1, KIFC1, KCNMA1, PLSCR4, RGN, GAS6, CRYAB, RAPGEF3, HBEGF, ZNF471, COL11A1, PRUNE2, ADCY4, ADCY2, ADCY5, PTGS1, RECQL4, ABI3BP, SPP1, DMD, CKB, RUNX1T1, AOC3, GSN, ATAD5, F10, F12, ATAD2, ADAM33, TTLL7, CENPE, SMOC2, FABP4, FABP6, MSRB3, LGR6, AGRN, PLCD4, LIMS2, ZNF331, DGKG, RASL11A, F13A1, FGF2, SLC8A1, FGF7, ZFP36, TUBB6, EFEMP1, TUBB3, PHYHD1, OIP5, MAP3K8, NEK2, STK32B, CPA3, CSGALNACT1, USP2, HIC1, FOXP2, TRAIP, MELK, RAB37, PGR, ROR1, TNIK, ROR2, RTN4R, ZNF671, PFKFB4, BLM, RNASEH2A, RNF180, ITPR1, AK4, RASAL1, PKMYT1, ORC1, NPTX1, TPPP, ZNF423, ATP8B4, ATP8B2, ZBTB16, CYBRD1, BMX, CDK1, BNC2, CPQ, LRRK2, FHL1, MCM10, ECE2, ADAMTS4, SGCE, ADAMTS5, SGCA, ADAMTS1, EXO1, DNMT3B, PGM5, ADAMTS8, ADAMTS9, PRKG1, PEG3, TRPC1, PARD3B, ITGA8, MCM4, BIRC5, ITGA7, ITGA5, SMPDL3B, MCM2, BIRC3, ITGA9, HDAC4, ACSS3, PRKAA2, C1S, ZBTB47, PCOLCE2, UHRF1, C1R, TTK, NDNF, LRP8, CLEC3B, RAB23, BCO2, SLC25A23, SLC25A25, JAZF1, NTRK2, PLCL1, PCDH7, SYT15, KLF4, KLF2, KLF6, RAD51, SYT11, P2RX1, MGP, APOC1, KLF9, CD248, TLL1, NAGS, CDO1, FOLR2, SPON1, HPSE2, MT1M, MKI67, ANTXR2, RPS6KA2, CHEK1, PDK4, RCC1, OXER1, EPHB2, PTGDS, EPHA7, EBF1, EBF3, ESCO2, CYP39A1, CYP27A1, SFRP1, CCDC80, CRISPLD2, DNA2, KIF20A, ZFPM2, EPHA3, NECAB1, MAOB, TSHZ3, RRAD, PDE1A, LPAR1, PCDH19, PCDH18, TRPM2, BRIP1, RRAS, RACGAP1, STXBP6, SPTBN2, EGR1, EGR2, DTNA, EGR3, XRCC2, ADHFE1, PDE2A, DCLK2, HSPA12A, DCLK1, CD22, DIRAS3, TOP2A, RYR2, FEN1, DIRAS1, KIF14, BRCA1, KIF11, RYR3, KIF15, NCS1, RAC3, TNFAIP8L3, CTSG, LMCD1, CD34, ZCCHC24, PSD, BHMT2, KIF24, RHOH, KIF23, HBA2, CBFA2T3, RHOB, NAALADL1, CEACAM5, RHOJ, KIT, KIF2C, PDZRN3, MATN3, PDZRN4, MATN2, POPDC2, TNXB, ADH1C, ADH1B, HAAO, PRICKLE2, CRIP2, TYMS, NT5E, RELN, MTHFD1L, RAD54L, SVIL, GAD1, MIS18A, KIF26A, AXL, KIF26B, TRIP13, CD69, RAB9B, ZFP28, PRDM8, ERCC6L, STEAP4, PRDM6, GIMAP1, BUB1B, ACTG2, CELSR3, NR3C2, EME1, ENPP2, ENPP1, SVEP1, PAMR1, PDGFRA, LMO3, GEM, PCP4, MASP1, FBN2, RASL12, GNAZ, PKDCC, NPR1, NPR2, LTBP4, FBLN1, CACNA1C, RASGRP2, ACACB, FBLN2, LPP, FBLN5, CACNA1H, SCUBE1, GRK5, NLRP3, MYH11, LONRF2, ACBD7, UBE2C, EPHX2, SMAD9, HSPA2, ESR1, SELE, SELP, GNAO1, NR4A2, NR4A1, KIF18A, KIF18B, GNAL, NR4A3, UBE2T, KIF4A, FGFR1, SNED1, PCDHGB7, THRA, CPXM2, ATP2A3, LDB3, SOBP, RND3, RERG, FYCO1, HEPH, PDE4B, SPEG, AOX1, CA9, PTGIS, MMP1, PDE4D, PLA2G4C, HUNK, DARS2, ABCC9, IRAK3, MYRIP, KLF15, TGFBR2, ACTA2, TGFBR3, ACTA1, GREM2, ACOX2, MMRN1, NAV3, CRY2, CASQ2, PDE5A, CREB5, COLEC12, COLEC11, NRXN1, NRXN3, NRXN2, PRELP, ATP1A2, NCALD, CYGB, AURKB, AURKA, GNA14, PDLIM3, RASD1, SLIT3, SLIT2, PDLIM4, BUB1, PDLIM7, SNCA, POLQ, GALNT6, RRM2, EYA4, PLA2G2A, HAGHL, ATP2B4, S100B, MAPK15, SOD3, ACTC1, SBK1, SCD, XPNPEP2, PDE7B	1117	6559	18869	1.2001734002347402	7.676390675959155E-4	4.744977050817611E-5	4.496971323350444E-5
GOTERM_MF_ALL	GO:0008201	GO:0008201~heparin binding	30	2.5231286795626575	4.92449727342825E-7	RTN4R, TNXB, CFH, PCOLCE2, COL11A1, NDNF, PRELP, FGF2, ADAMTS15, ADAMTS5, FGF7, CLEC3B, ADAMTS1, ABI3BP, RSPO3, CTSG, SLIT3, SLIT2, ADAMTS8, SOD3, SELP, TGFBR3, GREM2, SMOC2, SFRP1, CCDC80, CRISPLD2, LGR6, FGFR1, HBEGF	1117	176	18869	2.8794152356148772	7.817046691380725E-4	4.744977050817611E-5	4.496971323350444E-5
GOTERM_MF_ALL	GO:1901681	GO:1901681~sulfur compound binding	40	3.36417157275021	5.079635381857644E-7	RTN4R, RYR2, TNXB, CFH, HPSE2, PCOLCE2, COL11A1, NDNF, PRELP, FGF2, ACACB, ADAMTS15, ADAMTS5, FGF7, CLEC3B, ADAMTS1, ABI3BP, ANXA6, RSPO3, RCC1, ENPP1, CTSG, SLIT3, SLIT2, ADAMTS8, CD34, ACBD7, SOD3, SELP, TGFBR3, GREM2, SMOC2, SFRP1, CCDC80, CRISPLD2, P2RX1, LGR6, AGRN, FGFR1, HBEGF	1117	279	18869	2.4218737465625733	8.063210519168029E-4	4.744977050817611E-5	4.496971323350444E-5
GOTERM_MF_ALL	GO:0032555	GO:0032555~purine ribonucleotide binding	165	13.877207737594619	1.5677980252323612E-6	DGKG, ERCC6L, GIMAP1, RASL11A, BUB1B, ABCA12, MKI67, ACTG2, MYLK, RNF112, TUBB6, TUBB3, RPS6KA2, AKT3, CHEK1, PDK4, ENPP1, MAP3K8, NEK2, EPHB2, STK32B, BVES, GBP6, PDGFRA, EPHA7, PRKCB, STARD9, GEM, MELK, RAB37, ROR1, TNIK, ROR2, KIF20A, DNA2, EPHA3, RASL12, GNAZ, PIF1, PFKFB4, BLM, PKDCC, ABCB1, NPR1, RRAD, NPR2, ABCB4, AK4, PKMYT1, ACACB, PRKCZ, BRIP1, GRK5, RRAS, ORC1, PRKAR2B, NLRP3, MYH11, PIP5K1B, SLC19A1, PLK4, ATP8B4, ATP8B2, UBE2C, ABCA6, XRCC2, PDE2A, DNAH14, PLK1, ABCA9, DCLK2, CDC7, ABCA8, CDC6, HSPA2, HSPA12A, BMX, DCLK1, GNAO1, EHD2, KIF18A, GNAL, KIF18B, KIF4A, UBE2T, CDK1, FGFR1, DIRAS3, TOP2A, DIRAS1, LRRK2, KIF14, ATP2A3, PRKAG2, KIF11, RND3, RERG, KIF15, PDE4B, ANXA6, PBK, SPEG, RAC3, TK1, PRKG1, HELLS, PDE4D, HUNK, KIF24, DARS2, RHOH, KIF23, ABCC9, IRAK3, CIT, RHOB, TGFBR2, ACTA2, ITPKB, ACTA1, NAV3, KIFC1, PLSCR4, RHOJ, KIT, MCM4, PDE5A, KIF2C, RAPGEF3, MCM2, POPDC2, ACSS3, PRKAA2, ADCY4, TTK, ADCY2, ATP1A2, AURKB, ADCY5, AURKA, RECQL4, GNA14, RASD1, MTHFD1L, RAB23, RAD54L, CKB, BUB1, NTRK2, POLQ, ATAD5, ATAD2, ATP2B4, MAPK15, TTLL7, CENPE, RAD51, ACTC1, SBK1, KIF26A, AXL, KIF26B, P2RX1, TRIP13, RAB9B	1117	1949	18869	1.4301046424192927	0.0024865685695957263	1.2532022103228682E-4	1.1877010872392422E-4
GOTERM_MF_ALL	GO:0017076	GO:0017076~purine nucleotide binding	166	13.961312026913372	1.5707010619819333E-6	DGKG, ERCC6L, GIMAP1, RASL11A, BUB1B, ABCA12, MKI67, ACTG2, MYLK, RNF112, TUBB6, TUBB3, RPS6KA2, AKT3, CHEK1, PDK4, ENPP1, MAP3K8, NEK2, EPHB2, STK32B, BVES, GBP6, PDGFRA, EPHA7, PRKCB, STARD9, GEM, MELK, RAB37, ROR1, TNIK, ROR2, KIF20A, DNA2, EPHA3, RASL12, GNAZ, PIF1, PFKFB4, BLM, PKDCC, ABCB1, NPR1, RRAD, NPR2, ABCB4, AK4, PKMYT1, ACACB, PRKCZ, BRIP1, GRK5, BAG2, RRAS, ORC1, PRKAR2B, NLRP3, MYH11, PIP5K1B, SLC19A1, PLK4, ATP8B4, ATP8B2, UBE2C, ABCA6, XRCC2, PDE2A, DNAH14, PLK1, ABCA9, DCLK2, CDC7, ABCA8, CDC6, HSPA2, HSPA12A, BMX, DCLK1, GNAO1, EHD2, KIF18A, GNAL, KIF18B, KIF4A, UBE2T, CDK1, FGFR1, DIRAS3, TOP2A, DIRAS1, LRRK2, KIF14, ATP2A3, PRKAG2, KIF11, RND3, RERG, KIF15, PDE4B, ANXA6, PBK, SPEG, RAC3, TK1, PRKG1, HELLS, PDE4D, HUNK, KIF24, DARS2, RHOH, KIF23, ABCC9, IRAK3, CIT, RHOB, TGFBR2, ACTA2, ITPKB, ACTA1, NAV3, KIFC1, PLSCR4, RHOJ, KIT, MCM4, PDE5A, KIF2C, RAPGEF3, MCM2, POPDC2, ACSS3, PRKAA2, ADCY4, TTK, ADCY2, ATP1A2, AURKB, ADCY5, AURKA, RECQL4, GNA14, RASD1, MTHFD1L, RAB23, RAD54L, CKB, BUB1, NTRK2, POLQ, ATAD5, ATAD2, ATP2B4, MAPK15, TTLL7, CENPE, RAD51, ACTC1, SBK1, KIF26A, AXL, KIF26B, P2RX1, TRIP13, RAB9B	1117	1964	18869	1.427783359194234	0.002491167125531102	1.2532022103228682E-4	1.1877010872392422E-4
GOTERM_MF_ALL	GO:0005509	GO:0005509~calcium ion binding	78	6.56013456686291	1.578340315268096E-6	DGKG, SNED1, RYR2, PCDHGB7, SLC8A1, CELSR3, RYR3, SGCE, EFEMP1, SGCA, NCS1, ENPP2, ANXA6, ENPP1, SVEP1, PAMR1, PLA2G4C, NAALADL1, MMP12, PCP4, PLCB4, MMP13, MELK, MMRN1, PLSCR4, RGN, CASQ2, SPARCL1, MASP1, GAS6, MYL9, MATN3, PADI1, MATN2, FBN2, COLEC11, NECAB1, C1S, C1R, NRXN1, LTBP4, ITPR1, FBLN1, PCDH19, RASGRP2, FBLN2, PCDH18, LRP8, FBLN5, NCALD, TRPM2, CLEC3B, SCUBE1, SLIT3, SLIT2, SLC25A23, SLC25A25, SNCA, AOC3, GSN, F10, PCDH7, F12, PLA2G2A, SYT15, S100B, SELP, SMOC2, EHD2, SYT11, MGP, CD248, TLL1, DCHS1, FAT4, CD69, AGRN, PLCD4	1117	751	18869	1.7544878985584127	0.002503267984632185	1.2532022103228682E-4	1.1877010872392422E-4
GOTERM_MF_ALL	GO:0044877	GO:0044877~macromolecular complex binding	125	10.513036164844406	1.7271969394338E-6	TFRC, GMFG, CLU, FGF2, CDC20, ZFP36, MYC, CFL2, ENPP1, RCC1, EPHB2, PITX2, PKNOX2, TMOD1, PDGFRA, TPM2, HGF, TPM1, MAPK8IP2, CACNB2, BIN1, MAP1B, SPARCL1, RELL2, RTN4R, GNAZ, CDCA5, LTBP4, FBLN1, ADRB2, PRKCZ, IQGAP3, FBLN5, RRAS, NACC2, MYH11, NCKAP1L, CLSPN, SPTBN2, GPIHBP1, CAV1, PLK1, DSTN, ISG15, INHBA, IGF1, CORO2B, GNAO1, GNAL, CXCL12, CPEB2, NES, CD22, FERMT2, EZH2, CDKN1C, MYOM1, SYNM, THRA, COL14A1, LRRK2, ITGB3, RCSD1, MYOM2, CX3CL1, SYNE1, ADAMTS5, NUF2, ANXA6, FCER1A, EMILIN1, ADAMTS8, GFRA1, FOS, DCN, ADRA2A, TGFBR2, TGFBR3, MMP12, MMP13, COL6A2, TNNT2, ITGA8, ITGA7, ITGA5, MS4A2, CRYAB, PAFAH1B3, JDP2, GAS7, BIRC3, ITGA9, COLEC12, LRRC15, TAGLN, TNXB, PCOLCE2, UHRF1, NEXN, TTK, LRP8, GNA14, FCHO1, EPCAM, ABI3BP, SPP1, FLNA, DMD, FLNC, APBB1, JAM2, SNCA, JAM3, TUB, SVIL, MARCKSL1, GSN, GAD1, SORBS1, PODN, CENPE, CENPF, CENPH, P2RX1, PLP1	1117	1384	18869	1.5257017144394822	0.0027390330936211127	1.3060898761051783E-4	1.23782447326089E-4
GOTERM_MF_ALL	GO:1990939	GO:1990939~ATP-dependent microtubule motor activity	16	1.3456686291000841	1.8577086690749976E-6	STARD9, DNAH14, KIF14, KIF24, KIF23, KIF11, KIF15, CENPE, KIF18A, KIF18B, KIF26A, KIFC1, KIF4A, KIF26B, KIF2C, KIF20A	1117	61	18869	4.43083787076038	0.0029456970023719053	1.3409278938595893E-4	1.270841612253578E-4
GOTERM_MF_ALL	GO:0032553	GO:0032553~ribonucleotide binding	165	13.877207737594619	2.76744619457452E-6	DGKG, ERCC6L, GIMAP1, RASL11A, BUB1B, ABCA12, MKI67, ACTG2, MYLK, RNF112, TUBB6, TUBB3, RPS6KA2, AKT3, CHEK1, PDK4, ENPP1, MAP3K8, NEK2, EPHB2, STK32B, BVES, GBP6, PDGFRA, EPHA7, PRKCB, STARD9, GEM, MELK, RAB37, ROR1, TNIK, ROR2, KIF20A, DNA2, EPHA3, RASL12, GNAZ, PIF1, PFKFB4, BLM, PKDCC, ABCB1, NPR1, RRAD, NPR2, ABCB4, AK4, PKMYT1, ACACB, PRKCZ, BRIP1, GRK5, RRAS, ORC1, PRKAR2B, NLRP3, MYH11, PIP5K1B, SLC19A1, PLK4, ATP8B4, ATP8B2, UBE2C, ABCA6, XRCC2, PDE2A, DNAH14, PLK1, ABCA9, DCLK2, CDC7, ABCA8, CDC6, HSPA2, HSPA12A, BMX, DCLK1, GNAO1, EHD2, KIF18A, GNAL, KIF18B, KIF4A, UBE2T, CDK1, FGFR1, DIRAS3, TOP2A, DIRAS1, LRRK2, KIF14, ATP2A3, PRKAG2, KIF11, RND3, RERG, KIF15, PDE4B, ANXA6, PBK, SPEG, RAC3, TK1, PRKG1, HELLS, PDE4D, HUNK, KIF24, DARS2, RHOH, KIF23, ABCC9, IRAK3, CIT, RHOB, TGFBR2, ACTA2, ITPKB, ACTA1, NAV3, KIFC1, PLSCR4, RHOJ, KIT, MCM4, PDE5A, KIF2C, RAPGEF3, MCM2, POPDC2, ACSS3, PRKAA2, ADCY4, TTK, ADCY2, ATP1A2, AURKB, ADCY5, AURKA, RECQL4, GNA14, RASD1, MTHFD1L, RAB23, RAD54L, CKB, BUB1, NTRK2, POLQ, ATAD5, ATAD2, ATP2B4, MAPK15, TTLL7, CENPE, RAD51, ACTC1, SBK1, KIF26A, AXL, KIF26B, P2RX1, TRIP13, RAB9B	1117	1968	18869	1.41629773784309	0.004385068027865091	1.9107411117323206E-4	1.8108724012324577E-4
GOTERM_MF_ALL	GO:0008307	GO:0008307~structural constituent of muscle	13	1.0933557611438183	4.788386116634871E-6	MYOM1, SYNM, TPM2, TPM1, NEXN, SORBS2, MYOM2, PTPRD, SMTN, CSRP1, MYH11, DMD, MYL9	1117	43	18869	5.10705585975724	0.0075751382764059905	3.16831548050674E-4	3.002717127306451E-4
GOTERM_MF_ALL	GO:0030554	GO:0030554~adenyl nucleotide binding	138	11.606391925988225	5.120104075540452E-6	DGKG, ERCC6L, BUB1B, ABCA12, MKI67, ACTG2, MYLK, RPS6KA2, AKT3, CHEK1, PDK4, ENPP1, MAP3K8, NEK2, EPHB2, STK32B, BVES, PDGFRA, EPHA7, PRKCB, STARD9, MELK, ROR1, TNIK, ROR2, KIF20A, DNA2, EPHA3, PIF1, PFKFB4, BLM, PKDCC, ABCB1, NPR1, NPR2, ABCB4, AK4, PKMYT1, ACACB, PRKCZ, BRIP1, GRK5, BAG2, ORC1, PRKAR2B, NLRP3, MYH11, PIP5K1B, SLC19A1, PLK4, ATP8B4, ATP8B2, UBE2C, ABCA6, XRCC2, PDE2A, DNAH14, PLK1, ABCA9, DCLK2, CDC7, ABCA8, CDC6, HSPA2, HSPA12A, BMX, DCLK1, EHD2, KIF18A, KIF18B, KIF4A, UBE2T, CDK1, FGFR1, TOP2A, LRRK2, KIF14, ATP2A3, PRKAG2, KIF11, KIF15, PDE4B, PBK, SPEG, TK1, PRKG1, HELLS, PDE4D, HUNK, KIF24, DARS2, KIF23, ABCC9, IRAK3, CIT, TGFBR2, ACTA2, ITPKB, ACTA1, NAV3, KIFC1, PLSCR4, KIT, MCM4, KIF2C, RAPGEF3, MCM2, POPDC2, ACSS3, PRKAA2, ADCY4, TTK, ADCY2, ATP1A2, AURKB, ADCY5, AURKA, RECQL4, MTHFD1L, RAD54L, CKB, BUB1, NTRK2, POLQ, ATAD5, ATAD2, ATP2B4, MAPK15, TTLL7, CENPE, RAD51, ACTC1, SBK1, KIF26A, AXL, KIF26B, P2RX1, TRIP13	1117	1599	18869	1.4578952937797405	0.008097780975226176	3.252290108783295E-4	3.082302653475352E-4
GOTERM_MF_ALL	GO:0032559	GO:0032559~adenyl ribonucleotide binding	137	11.522287636669471	5.325905226745634E-6	DGKG, ERCC6L, BUB1B, ABCA12, MKI67, ACTG2, MYLK, RPS6KA2, AKT3, CHEK1, PDK4, ENPP1, MAP3K8, NEK2, EPHB2, STK32B, BVES, PDGFRA, EPHA7, PRKCB, STARD9, MELK, ROR1, TNIK, ROR2, KIF20A, DNA2, EPHA3, PIF1, PFKFB4, BLM, PKDCC, ABCB1, NPR1, NPR2, ABCB4, AK4, PKMYT1, ACACB, PRKCZ, BRIP1, GRK5, ORC1, PRKAR2B, NLRP3, MYH11, PIP5K1B, SLC19A1, PLK4, ATP8B4, ATP8B2, UBE2C, ABCA6, XRCC2, PDE2A, DNAH14, PLK1, ABCA9, DCLK2, CDC7, ABCA8, CDC6, HSPA2, HSPA12A, BMX, DCLK1, EHD2, KIF18A, KIF18B, KIF4A, UBE2T, CDK1, FGFR1, TOP2A, LRRK2, KIF14, ATP2A3, PRKAG2, KIF11, KIF15, PDE4B, PBK, SPEG, TK1, PRKG1, HELLS, PDE4D, HUNK, KIF24, DARS2, KIF23, ABCC9, IRAK3, CIT, TGFBR2, ACTA2, ITPKB, ACTA1, NAV3, KIFC1, PLSCR4, KIT, MCM4, KIF2C, RAPGEF3, MCM2, POPDC2, ACSS3, PRKAA2, ADCY4, TTK, ADCY2, ATP1A2, AURKB, ADCY5, AURKA, RECQL4, MTHFD1L, RAD54L, CKB, BUB1, NTRK2, POLQ, ATAD5, ATAD2, ATP2B4, MAPK15, TTLL7, CENPE, RAD51, ACTC1, SBK1, KIF26A, AXL, KIF26B, P2RX1, TRIP13	1117	1586	18869	1.4591942026302214	0.00842189547721417	3.2528990384892564E-4	3.0828797562508384E-4
GOTERM_MF_ALL	GO:0098772	GO:0098772~molecular function regulator	135	11.35407905803196	8.367145427345533E-6	GMFG, ARHGAP39, FRY, CDC20, RGS5, RGS2, CCND2, PTTG1, RCC1, RGS9, SCN1B, PRKCB, STARD8, SERPINF1, ATP1B2, MAPK8IP2, DKK1, GEM, DEPDC1B, CCNE2, BIN1, PPP1R3B, CCNE1, NUPR1, PIF1, RRAD, KCNE4, ITPR1, FBLN1, RASAL1, ADRB2, ARHGAP15, RASGRP2, FBLN2, PRKCZ, IQGAP3, RAP1GAP, C3, SOCS3, CCNB2, CCNB1, ARHGAP20, BAG2, RACGAP1, PRKAR2B, KCNMB1, NCKAP1L, A2M, ECT2, WNT2, GPIHBP1, STARD13, ARHGEF37, TNFSF12, CAV1, TFPI2, PARVA, ESR1, ARHGAP24, RCAN1, TPX2, RCAN2, PPP1R1B, FXYD1, BCL2, FXYD6, PKIG, FGF13, CPEB2, FGF11, CDKN1C, ARHGAP11A, SERPINA3, LRRK2, NCAPG2, ATP2A3, HSPB2, WFDC1, PRKAG2, AREG, ARHGAP6, CKS1B, NCS1, CTSG, TIMP4, PRKG1, GARNL3, SNTA1, PSD, LYNX1, ARHGEF15, DENND2A, RHOH, ABCC9, WNT9A, CIT, CCNA2, ARHGAP10, GREM2, ZEB2, TAL1, DEPDC1, CKS2, RGN, CDC42EP2, BIRC5, PPP1R12B, GAS6, SCN4B, RAPGEF3, HBEGF, BIRC3, ITIH5, PCOLCE2, NRXN1, NRXN2, SEMA3E, TFPI, LTC4S, CST6, PLN, FLNA, SLIT2, SNCA, PPP1R14A, ATP2B4, KLF4, PPP2R2B, COL7A1, DLC1, APOC1, PI16, RGS11, PLCD4, RECK	1117	1572	18869	1.4506977522945184	0.013199198914601196	4.921121088379522E-4	4.663908840057418E-4
GOTERM_MF_ALL	GO:0036094	GO:0036094~small molecule binding	207	17.40958788898234	9.480700285642673E-6	ABCA12, MKI67, MYLK, RNF112, RPS6KA2, CHEK1, AKT3, PDK4, OXER1, EPHB2, PTGDS, BVES, GBP6, EPHA7, PRKCB, STARD9, RBP7, RBP1, DNA2, KIF20A, EPHA3, PIF1, ABCB1, MAOB, RRAD, ABCB4, PRKCZ, BRIP1, RRAS, PRKAR2B, PIP5K1B, APOD, SLC19A1, PLK4, ABCA6, XRCC2, PDE2A, DNAH14, PLK1, ABCA9, DCLK2, CDC7, ABCA8, CDC6, HSPA12A, DCLK1, GRIN2D, SQLE, EHD2, CD22, DIRAS3, TOP2A, DIRAS1, KIF14, PRKAG2, PYGM, KIF11, KIF15, OSBPL10, PBK, ANXA6, RAC3, TK1, HELLS, KIF24, RHOH, KIF23, HBA2, CIT, RHOB, ITPKB, KIFC1, RHOJ, KIT, PLSCR4, KIF2C, RAPGEF3, POPDC2, ADCY4, ADCY2, TYMS, ADCY5, RECQL4, NT5E, MTHFD1L, SPP1, RAD54L, CKB, ATAD5, GAD1, ATAD2, TTLL7, CENPE, FABP4, KIF26A, AXL, FABP6, KIF26B, TRIP13, AGRN, RAB9B, DGKG, ERCC6L, STEAP4, GIMAP1, RASL11A, BUB1B, ACTG2, TUBB6, TUBB3, ENPP1, NEK2, MAP3K8, STK32B, PDGFRA, GEM, MELK, RAB37, ROR1, TNIK, ROR2, RTN4R, RASL12, GNAZ, PFKFB4, BLM, PKDCC, NPR1, NPR2, ITPR1, AK4, PKMYT1, ACACB, GRK5, BAG2, ORC1, NLRP3, MYH11, KL, ATP8B4, ATP8B2, UBE2C, CAV1, HSPA2, BMX, SELE, GNAO1, SELP, KIF18A, GNAL, KIF18B, KIF4A, UBE2T, CDK1, DHCR7, FGFR1, LRRK2, ATP2A3, SLC2A3, RND3, RERG, ALDH2, PDE4B, SPEG, AOX1, PRKG1, PDE4D, TRPC1, HUNK, DARS2, ABCC9, IRAK3, TGFBR2, ACTA2, ACTA1, ACOX2, NAV3, CRY2, MCM4, PDE5A, MCM2, COLEC12, COLEC11, ACSS3, PRKAA2, UHRF1, TTK, ATP1A2, AURKB, AURKA, GNA14, RASD1, RAB23, CRYM, BUB1, NTRK2, POLQ, PLCL1, ATP2B4, MAPK15, ACTC1, SBK1, RAD51, P2RX1, APOC1, NAGS, FOLR2	1117	2634	18869	1.3275481632994333	0.014942657158350303	5.236359442492759E-4	4.962670630322168E-4
GOTERM_MF_ALL	GO:0003777	GO:0003777~microtubule motor activity	16	1.3456686291000841	9.562621148129094E-6	STARD9, DNAH14, KIF14, KIF24, KIF23, KIF11, KIF15, CENPE, KIF18A, KIF18B, KIF26A, KIFC1, KIF4A, KIF26B, KIF2C, KIF20A	1117	69	18869	3.9171175379185965	0.015070796477939408	5.236359442492759E-4	4.962670630322168E-4
GOTERM_MF_ALL	GO:0019899	GO:0019899~enzyme binding	176	14.802354920100925	1.2011458531900265E-5	CSF3, TFRC, DIXDC1, CLU, CDC20, ZFP36, CCND2, RUSC2, RASSF3, DPYSL2, RCC1, KNTC1, NEK2, KPNA2, IL6R, KCNH2, MEF2C, BORA, PRKCB, MAGI2, USP2, ANK2, UNC5C, ATP1B2, SYTL5, CDC25C, MAPK8IP2, HIC1, CDC25A, CACNB4, CCNE2, BIN1, PPP1R3B, FANCD2, CCNE1, DAAM2, FEZ1, PGR, ROR2, KIF20A, ABCB1, STXBP1, RNF180, GATA6, ADRB2, PRKCZ, IQGAP3, RAP1GAP, CCNB1, GRK5, BAG2, RACGAP1, PRKAR2B, NACC2, EIF4EBP1, A2M, ECT2, PPARGC1A, GPIHBP1, FANCI, EGR1, NGFR, CDT1, EGR2, DTNA, JUND, UBE2C, CAV1, PLK1, ISG15, CDC6, HSPA2, SELE, ESR1, TPX2, NR4A3, DLG2, DIAPH3, NBEA, UBE2T, BCL2, RADIL, CSPG4, CD22, FERMT2, TOP2A, MYOM1, RYR2, LRRK2, ITGB3, KIF14, TCF21, PRKAG2, MCM10, LDB3, SNX10, LDB2, BRCA1, KIF11, FOXM1, BRCA2, RND3, ARHGAP6, MYOM2, SYNE1, CKS1B, LMNB1, ADAMTS4, AKAP12, GHR, ADAMTSL4, NCS1, BDKRB2, DNMT3B, DACT3, RAC3, CTSG, TIMP4, SNTA1, DUSP5, MYOCD, DUSP1, PDE4D, TRPC1, TFEB, RHOH, IRAK3, MYRIP, DUSP8, ADRA2A, CIT, RHOB, TGFBR2, ACTA2, CCNA2, TAL1, PLSCR4, CRY2, KIT, CKS2, CDC42EP2, BIRC5, IRF5, PPP1R12B, GAS6, MCM2, HDAC4, SRF, ADCY4, AKAP6, ADCY2, PHYHIP, RASIP1, AURKB, ADCY5, AURKA, PLN, E2F1, FLNA, DMD, APBB1, CKB, PDLIM4, SNCA, CAP2, NTRK2, GSN, ANGPT1, ATP2B4, KLF4, PER1, RAD51, PER3, PRC1, SYT11, SLMAP	1117	2180	18869	1.3638037666423004	0.01889354717739611	6.358065382885874E-4	6.0257483635033E-4
GOTERM_MF_ALL	GO:0042803	GO:0042803~protein homodimerization activity	72	6.055508830950378	1.2734840659417116E-5	TOP2A, MYOM1, HSPB6, TFRC, CPQ, LRRK2, HSPB8, PTH1R, SYNE1, GHR, GLIPR2, RBPMS2, ENPP1, AOX1, PITX2, IL6R, EPM2A, KCNH2, PDGFRA, TPM2, TPM1, DARS2, IRAK3, ADRA2A, FOXP2, NAALADL1, ACOX2, CEACAM5, HAND2, KIT, CASQ2, BIRC5, MASP1, CRYAB, PAFAH1B3, JDP2, MGLL, ATF3, BLM, SRF, ODC1, ADRB2, TYMS, RASIP1, FBLN5, RAP1GAP, PLN, MTHFD1L, NACC2, FLNA, SLIT2, TPPP, CRYM, ECT2, PDLIM4, JAM3, NTRK2, WWTR1, CADM3, RRM2, RBPMS, EPHX2, ZBTB16, PDE2A, INHBB, S100B, CENPF, NR4A3, BCL2, C16ORF89, FGFR1, MAD2L1	1117	716	18869	1.6986941278264307	0.020019941247388928	6.523524828114316E-4	6.182559739491213E-4
GOTERM_MF_ALL	GO:0046983	GO:0046983~protein dimerization activity	101	8.494533221194281	1.4049141860465283E-5	TFRC, CLU, MYC, ENPP1, RCC1, PITX2, IL6R, EPM2A, KCNH2, PDGFRA, MEF2C, TPM2, TPM1, MITF, ATP1B2, FOXP2, AGTR1, MASP1, ATF3, BLM, TWIST2, ADRB2, FBLN5, RAP1GAP, NACC2, TPPP, ECT2, WWTR1, CADM3, RBPMS, EPHX2, ZBTB16, CAV1, PDE2A, INHBB, NR4A2, NR4A1, NR4A3, ID2, ID4, BCL2, SIM2, FGFR1, TOP2A, MYOM1, HSPB6, CPQ, LRRK2, HSPB8, TCF21, HIF3A, PTH1R, SYNE1, GHR, GLIPR2, BDKRB2, RBPMS2, AOX1, TFEB, DARS2, IRAK3, ANO5, ADRA2A, NAALADL1, ACOX2, CEACAM6, TAL1, CEACAM5, HAND2, KIT, CASQ2, BIRC5, CRYAB, PAFAH1B3, JDP2, MGLL, SRF, ODC1, ATP1A2, TYMS, CENPA, RASIP1, AURKA, PLN, MTHFD1L, ATOH8, E2F1, FLNA, E2F2, SLIT2, CRYM, PDLIM4, JAM3, AOC3, NTRK2, CENPW, RRM2, S100B, CENPF, C16ORF89, MAD2L1	1117	1109	18869	1.5384576263387453	0.022063162136227943	6.971886648255897E-4	6.607487031250078E-4
GOTERM_MF_ALL	GO:0019900	GO:0019900~kinase binding	80	6.72834314550042	1.4957578844579432E-5	TOP2A, MYOM1, RYR2, TFRC, ITGB3, KIF14, DIXDC1, PRKAG2, LDB3, KIF11, FOXM1, RND3, MYOM2, CKS1B, GHR, ZFP36, CCND2, DPYSL2, NCS1, DACT3, RAC3, DUSP5, BORA, DUSP1, PRKCB, RHOH, ANK2, UNC5C, IRAK3, DUSP8, CDC25C, MAPK8IP2, ADRA2A, CDC25A, RHOB, TGFBR2, CIT, ACTA2, CCNA2, CACNB4, CCNE2, CCNE1, FEZ1, CRY2, CKS2, IRF5, KIF20A, ROR2, PPP1R12B, GAS6, HDAC4, STXBP1, ADCY4, GATA6, PHYHIP, PRKCZ, AURKB, AURKA, CCNB1, GRK5, RACGAP1, PRKAR2B, E2F1, FLNA, GSN, ANGPT1, CAV1, PLK1, ATP2B4, CDC6, ESR1, TPX2, PER1, PER3, DLG2, NR4A3, NBEA, PRC1, CSPG4, FERMT2	1117	825	18869	1.638067334038686	0.023472935129231542	7.197768243997618E-4	6.821562473058195E-4
GOTERM_MF_ALL	GO:0035639	GO:0035639~purine ribonucleoside triphosphate binding	156	13.12026913372582	1.8006902464292407E-5	DGKG, ERCC6L, GIMAP1, RASL11A, BUB1B, ABCA12, MKI67, ACTG2, MYLK, RNF112, TUBB6, TUBB3, RPS6KA2, AKT3, CHEK1, PDK4, ENPP1, MAP3K8, NEK2, EPHB2, STK32B, GBP6, PDGFRA, EPHA7, PRKCB, STARD9, GEM, MELK, RAB37, ROR1, TNIK, ROR2, KIF20A, DNA2, EPHA3, RASL12, GNAZ, PIF1, PFKFB4, BLM, PKDCC, ABCB1, NPR1, RRAD, NPR2, ABCB4, AK4, PKMYT1, ACACB, PRKCZ, BRIP1, GRK5, RRAS, ORC1, NLRP3, MYH11, PIP5K1B, PLK4, ATP8B4, ATP8B2, UBE2C, ABCA6, XRCC2, DNAH14, PLK1, ABCA9, DCLK2, CDC7, ABCA8, CDC6, HSPA2, HSPA12A, BMX, DCLK1, GNAO1, EHD2, KIF18A, GNAL, KIF18B, KIF4A, UBE2T, CDK1, FGFR1, DIRAS3, TOP2A, DIRAS1, LRRK2, KIF14, ATP2A3, PRKAG2, KIF11, RND3, RERG, KIF15, ANXA6, PBK, SPEG, RAC3, TK1, PRKG1, HELLS, HUNK, KIF24, DARS2, RHOH, KIF23, ABCC9, IRAK3, CIT, RHOB, TGFBR2, ACTA2, ITPKB, ACTA1, NAV3, KIFC1, PLSCR4, RHOJ, KIT, MCM4, KIF2C, MCM2, ACSS3, PRKAA2, ADCY4, TTK, ADCY2, ATP1A2, AURKB, ADCY5, AURKA, RECQL4, GNA14, RASD1, MTHFD1L, RAB23, RAD54L, CKB, BUB1, NTRK2, POLQ, ATAD5, ATAD2, ATP2B4, MAPK15, TTLL7, CENPE, RAD51, ACTC1, SBK1, KIF26A, AXL, KIF26B, P2RX1, TRIP13, RAB9B	1117	1902	18869	1.3855104225208916	0.028190244594525127	8.410282680381277E-4	7.970702414341198E-4
GOTERM_MF_ALL	GO:0000166	GO:0000166~nucleotide binding	178	14.970563498738434	2.023310908489667E-5	DGKG, ERCC6L, STEAP4, GIMAP1, RASL11A, BUB1B, ABCA12, MKI67, ACTG2, MYLK, RNF112, TUBB6, TUBB3, RPS6KA2, AKT3, CHEK1, PDK4, ENPP1, MAP3K8, NEK2, EPHB2, STK32B, BVES, GBP6, PDGFRA, EPHA7, PRKCB, STARD9, GEM, MELK, RAB37, ROR1, TNIK, ROR2, KIF20A, DNA2, EPHA3, RASL12, GNAZ, PIF1, PFKFB4, BLM, PKDCC, ABCB1, MAOB, NPR1, RRAD, NPR2, ABCB4, AK4, PKMYT1, ACACB, PRKCZ, BRIP1, GRK5, BAG2, RRAS, ORC1, PRKAR2B, NLRP3, MYH11, PIP5K1B, SLC19A1, PLK4, ATP8B4, ATP8B2, UBE2C, ABCA6, XRCC2, PDE2A, DNAH14, PLK1, ABCA9, DCLK2, CDC7, ABCA8, CDC6, HSPA2, HSPA12A, BMX, DCLK1, GNAO1, SQLE, EHD2, KIF18A, GNAL, KIF18B, KIF4A, UBE2T, CDK1, DHCR7, FGFR1, DIRAS3, TOP2A, DIRAS1, LRRK2, KIF14, ATP2A3, PRKAG2, PYGM, KIF11, RND3, RERG, KIF15, ALDH2, PDE4B, ANXA6, PBK, SPEG, AOX1, RAC3, TK1, PRKG1, HELLS, PDE4D, HUNK, KIF24, DARS2, RHOH, KIF23, ABCC9, IRAK3, CIT, RHOB, TGFBR2, ACTA2, ITPKB, ACTA1, ACOX2, NAV3, KIFC1, PLSCR4, RHOJ, CRY2, KIT, MCM4, PDE5A, KIF2C, RAPGEF3, MCM2, POPDC2, ACSS3, PRKAA2, UHRF1, ADCY4, TTK, ADCY2, ATP1A2, AURKB, ADCY5, AURKA, RECQL4, GNA14, NT5E, RASD1, MTHFD1L, RAB23, RAD54L, CKB, CRYM, BUB1, NTRK2, POLQ, ATAD5, ATAD2, ATP2B4, MAPK15, TTLL7, CENPE, RAD51, ACTC1, SBK1, KIF26A, AXL, KIF26B, P2RX1, TRIP13, RAB9B	1117	2229	18869	1.3489804172475381	0.031619801989104857	9.01070129668493E-4	8.539738949314118E-4
GOTERM_MF_ALL	GO:1901265	GO:1901265~nucleoside phosphate binding	178	14.970563498738434	2.042728253656533E-5	DGKG, ERCC6L, STEAP4, GIMAP1, RASL11A, BUB1B, ABCA12, MKI67, ACTG2, MYLK, RNF112, TUBB6, TUBB3, RPS6KA2, AKT3, CHEK1, PDK4, ENPP1, MAP3K8, NEK2, EPHB2, STK32B, BVES, GBP6, PDGFRA, EPHA7, PRKCB, STARD9, GEM, MELK, RAB37, ROR1, TNIK, ROR2, KIF20A, DNA2, EPHA3, RASL12, GNAZ, PIF1, PFKFB4, BLM, PKDCC, ABCB1, MAOB, NPR1, RRAD, NPR2, ABCB4, AK4, PKMYT1, ACACB, PRKCZ, BRIP1, GRK5, BAG2, RRAS, ORC1, PRKAR2B, NLRP3, MYH11, PIP5K1B, SLC19A1, PLK4, ATP8B4, ATP8B2, UBE2C, ABCA6, XRCC2, PDE2A, DNAH14, PLK1, ABCA9, DCLK2, CDC7, ABCA8, CDC6, HSPA2, HSPA12A, BMX, DCLK1, GNAO1, SQLE, EHD2, KIF18A, GNAL, KIF18B, KIF4A, UBE2T, CDK1, DHCR7, FGFR1, DIRAS3, TOP2A, DIRAS1, LRRK2, KIF14, ATP2A3, PRKAG2, PYGM, KIF11, RND3, RERG, KIF15, ALDH2, PDE4B, ANXA6, PBK, SPEG, AOX1, RAC3, TK1, PRKG1, HELLS, PDE4D, HUNK, KIF24, DARS2, RHOH, KIF23, ABCC9, IRAK3, CIT, RHOB, TGFBR2, ACTA2, ITPKB, ACTA1, ACOX2, NAV3, KIFC1, PLSCR4, RHOJ, CRY2, KIT, MCM4, PDE5A, KIF2C, RAPGEF3, MCM2, POPDC2, ACSS3, PRKAA2, UHRF1, ADCY4, TTK, ADCY2, ATP1A2, AURKB, ADCY5, AURKA, RECQL4, GNA14, NT5E, RASD1, MTHFD1L, RAB23, RAD54L, CKB, CRYM, BUB1, NTRK2, POLQ, ATAD5, ATAD2, ATP2B4, MAPK15, TTLL7, CENPE, RAD51, ACTC1, SBK1, KIF26A, AXL, KIF26B, P2RX1, TRIP13, RAB9B	1117	2230	18869	1.3483754932936156	0.03191835958292488	9.01070129668493E-4	8.539738949314118E-4
GOTERM_MF_ALL	GO:0019901	GO:0019901~protein kinase binding	72	6.055508830950378	3.074812050019339E-5	TOP2A, RYR2, TFRC, ITGB3, KIF14, DIXDC1, PRKAG2, LDB3, KIF11, FOXM1, RND3, CKS1B, GHR, ZFP36, CCND2, DPYSL2, NCS1, DACT3, RAC3, DUSP5, BORA, DUSP1, PRKCB, RHOH, ANK2, UNC5C, IRAK3, DUSP8, CDC25C, MAPK8IP2, ADRA2A, CDC25A, RHOB, TGFBR2, CIT, ACTA2, CCNA2, CACNB4, CCNE2, CCNE1, FEZ1, CRY2, CKS2, IRF5, KIF20A, ROR2, PPP1R12B, GAS6, HDAC4, STXBP1, ADCY4, GATA6, PHYHIP, PRKCZ, AURKA, CCNB1, GRK5, RACGAP1, PRKAR2B, E2F1, FLNA, ANGPT1, CAV1, PLK1, ATP2B4, ESR1, TPX2, NR4A3, NBEA, PRC1, CSPG4, FERMT2	1117	736	18869	1.652533961309408	0.04765581060958601	0.0013196760906569488	0.001250700577102461
GOTERM_MF_ALL	GO:0016247	GO:0016247~channel regulator activity	24	2.0185029436501263	4.1566636028838546E-5	LYNX1, PRKCB, KCNE4, RRAD, NRXN1, CAV1, ATP2B4, ITPR1, NRXN2, ABCC9, ADRB2, PRKCZ, GEM, KCNMB1, FXYD1, BCL2, FLNA, FXYD6, FGF13, SCN4B, FGF11, SCN1B, PRKG1, SNTA1	1117	155	18869	2.6156236462875793	0.06387773863031065	0.0017370478424683056	0.0016462575585105793
