CATEGORY	GO_ID	GO_LABEL_FULL	COUNT	PERCENTAGE	P_VALUE	GENES	LIST_TOTAL	POP_HITS	POP_TOTAL	FOLD_ENRICHMENT	BONFERRONI	BENJAMINI	FDR
GOTERM_MF_ALL	GO:0001159	GO:0001159~core promoter proximal region DNA binding	89	7.485281749369217	0.03457447718052929	ZNF331, THRA, SIX1, HIF3A, MEOX2, MEOX1, NR3C2, SOX17, SIX4, MYC, MYB, MYBL2, PITX2, SOX7, JUNB, PITX1, SOX4, PKNOX2, MEF2C, TFEB, EBF1, EBF3, MITF, FOS, SOX10, ETV4, KLF15, HIC1, FOXP2, ZEB2, ZEB1, TAL1, IRF5, PGR, JDP2, ATF3, CREB5, HDAC4, ZNF671, NFIX, HLF, ZNF471, CEBPD, ZBTB47, UHRF1, SRF, GATA6, CREM, GATA5, NACC2, ATOH8, PRDM16, E2F1, E2F2, NDN, MSX1, OTX1, ZNF423, E2F7, ZSCAN18, E2F8, EGR1, EGR2, JUND, EGR3, FOXF1, ZBTB16, NR2F1, SMAD9, KLF4, TBX5, ESR1, KLF2, NFATC4, POU6F1, NR4A2, FOSL1, PER1, NR4A1, KLF6, NR4A3, NFIA, NFIB, KLF9, MAFF, FOSB, ZNF135, ZFP28, EZH2	1117	1225	18869	1.227296877569291	1.0	0.3368360108139909	0.3192306021883226
GOTERM_MF_ALL	GO:0000987	GO:0000987~core promoter proximal region sequence-specific DNA binding	89	7.485281749369217	0.03457447718052929	ZNF331, THRA, SIX1, HIF3A, MEOX2, MEOX1, NR3C2, SOX17, SIX4, MYC, MYB, MYBL2, PITX2, SOX7, JUNB, PITX1, SOX4, PKNOX2, MEF2C, TFEB, EBF1, EBF3, MITF, FOS, SOX10, ETV4, KLF15, HIC1, FOXP2, ZEB2, ZEB1, TAL1, IRF5, PGR, JDP2, ATF3, CREB5, HDAC4, ZNF671, NFIX, HLF, ZNF471, CEBPD, ZBTB47, UHRF1, SRF, GATA6, CREM, GATA5, NACC2, ATOH8, PRDM16, E2F1, E2F2, NDN, MSX1, OTX1, ZNF423, E2F7, ZSCAN18, E2F8, EGR1, EGR2, JUND, EGR3, FOXF1, ZBTB16, NR2F1, SMAD9, KLF4, TBX5, ESR1, KLF2, NFATC4, POU6F1, NR4A2, FOSL1, PER1, NR4A1, KLF6, NR4A3, NFIA, NFIB, KLF9, MAFF, FOSB, ZNF135, ZFP28, EZH2	1117	1225	18869	1.227296877569291	1.0	0.3368360108139909	0.3192306021883226
GOTERM_MF_ALL	GO:0003690	GO:0003690~double-stranded DNA binding	120	10.09251471825063	0.03720937466360796	ZNF331, NR3C2, SOX17, MYC, CREB3L1, MYB, PITX2, SOX7, JUNB, PITX1, SOX4, PKNOX2, TSPYL2, KCNH2, MEF2C, EBF1, ARID5A, EBF3, MITF, SOX10, HIC1, FOXP2, PGR, ATF3, ZNF671, GATA6, TWIST2, CREM, GATA5, RAD51AP1, ORC1, NACC2, PRDM16, NDN, OTX1, ZNF423, ZSCAN18, EGR1, EGR2, JUND, EGR3, FOXF1, ZBTB16, NR2F1, SMAD9, CDC6, ESR1, POU6F1, NFATC4, NR4A2, FOSL1, NR4A1, NR4A3, MAFF, SIM2, ZNF135, EZH2, FEN1, BNC2, THRA, TCF21, HMGB3, SIX1, MCM10, HIF3A, BRCA1, FOXM1, AFF3, MEOX2, MEOX1, LMNB1, JPH2, SIX4, MYBL2, PEG3, TFEB, FOS, ETV4, KLF15, MMP12, ZEB2, ZEB1, TAL1, HAND2, CRY2, MCM4, IRF5, KIF2C, JDP2, MCM2, CREB5, HDAC4, HLF, NFIX, ZNF471, CEBPD, ZBTB47, UHRF1, SRF, CDC45, ATOH8, E2F1, E2F2, MSX1, E2F7, E2F8, SNCA, KLF4, TBX5, KLF2, PER2, PER1, KLF6, RAD51, PER3, NFIA, NFIB, KLF9, FOSB, ZFP28	1117	1719	18869	1.1792369551325619	1.0	0.3602956522305454	0.34146407846786575
GOTERM_MF_ALL	GO:0098531	GO:0098531~transcription factor activity, direct ligand regulated sequence-specific DNA binding	8	0.6728343145500421	0.03890509049217154	NR4A2, NR4A1, NR4A3, THRA, NR2F1, PGR, ESR1, NR3C2	1117	54	18869	2.5026028714479924	1.0	0.37217640784077355	0.3527238625946878
GOTERM_MF_ALL	GO:0004879	GO:0004879~RNA polymerase II transcription factor activity, ligand-activated sequence-specific DNA binding	8	0.6728343145500421	0.03890509049217154	NR4A2, NR4A1, NR4A3, THRA, NR2F1, PGR, ESR1, NR3C2	1117	54	18869	2.5026028714479924	1.0	0.37217640784077355	0.3527238625946878
GOTERM_MF_ALL	GO:0030414	GO:0030414~peptidase inhibitor activity	19	1.59798149705635	0.04085799162580117	ITIH5, SERPINA3, SERPINF1, TFPI2, WFDC1, TFPI, CST6, C3, PTTG1, BIN1, COL7A1, BIRC5, PI16, A2M, GAS6, RECK, TIMP4, BIRC3, SNCA	1117	195	18869	1.6459426577600256	1.0	0.38851790839384587	0.3682112418971902
GOTERM_MF_ALL	GO:0000978	GO:0000978~RNA polymerase II core promoter proximal region sequence-specific DNA binding	87	7.317073170731707	0.04111362704205279	ZNF331, THRA, SIX1, HIF3A, MEOX2, MEOX1, NR3C2, SOX17, SIX4, MYC, MYB, MYBL2, PITX2, SOX7, JUNB, PITX1, SOX4, PKNOX2, MEF2C, TFEB, EBF1, EBF3, MITF, FOS, SOX10, ETV4, KLF15, HIC1, FOXP2, ZEB2, ZEB1, TAL1, IRF5, PGR, JDP2, ATF3, CREB5, HDAC4, ZNF671, NFIX, HLF, ZNF471, CEBPD, ZBTB47, SRF, GATA6, CREM, GATA5, NACC2, ATOH8, PRDM16, E2F1, E2F2, NDN, OTX1, ZNF423, E2F7, ZSCAN18, E2F8, EGR1, EGR2, JUND, EGR3, FOXF1, ZBTB16, NR2F1, SMAD9, KLF4, TBX5, ESR1, KLF2, NFATC4, POU6F1, NR4A2, FOSL1, PER1, NR4A1, KLF6, NR4A3, NFIA, NFIB, KLF9, MAFF, FOSB, ZNF135, ZFP28, EZH2	1117	1207	18869	1.217608563593897	1.0	0.38862166513559426	0.3683095755850563
GOTERM_MF_ALL	GO:0001085	GO:0001085~RNA polymerase II transcription factor binding	20	1.682085786375105	0.04148930682183195	HDAC4, EGR2, MEF2C, MYOCD, SRF, GATA6, FOS, LDB2, KLF4, TBX5, ESR1, SOX17, TAL1, ID2, HAND2, ID4, ZFPM2, PITX2, CD34, PITX1	1117	209	18869	1.6165138164855453	1.0	0.38985218481106	0.3694757796855449
GOTERM_MF_ALL	GO:0043515	GO:0043515~kinetochore binding	3	0.2523128679562658	0.04470312020973771	CENPE, CENPH, TTK	1117	6	18869	8.446284691136976	1.0	0.41513774791265196	0.3934397421968144
GOTERM_MF_ALL	GO:1904929	GO:1904929~coreceptor activity involved in Wnt signaling pathway, planar cell polarity pathway	3	0.2523128679562658	0.04470312020973771	ROR1, ROR2, GPC6	1117	6	18869	8.446284691136976	1.0	0.41513774791265196	0.3934397421968144
GOTERM_MF_ALL	GO:0015079	GO:0015079~potassium ion transmembrane transporter activity	16	1.3456686291000841	0.04543574929931861	KCNG1, KCNH2, SLC24A3, KCND3, KCNE4, GRIK5, GRIK3, ABCC9, ATP1A2, AQP1, SLC9A7, KCNMB1, KCNMA1, SLC9A9, KCNN3, KCNK3	1117	157	18869	1.7215357332253705	1.0	0.4194881970192904	0.39756280636903785
GOTERM_MF_ALL	GO:0046332	GO:0046332~SMAD binding	10	0.8410428931875525	0.046198170470610644	TGFBR3, MYOCD, CREB3L1, TGFB1I1, MAGI2, FLNA, SMAD9, FOS, FERMT2, TGFBR2	1117	80	18869	2.1115711727842434	1.0	0.4240618191175127	0.4018973789495319
GOTERM_MF_ALL	GO:0005125	GO:0005125~cytokine activity	22	1.8502943650126156	0.047220862145003206	IL33, CSF3, WNT2B, TSLP, CCL21, IL34, TNFSF12, BMP8B, INHBB, INHBA, WNT9A, FGF2, CXCL2, AREG, CX3CL1, BMP5, GREM2, IL6, CXCL12, SPP1, CCL2, WNT2	1117	240	18869	1.5484855267084452	1.0	0.43095821313945454	0.40843331912775765
GOTERM_MF_ALL	GO:0030291	GO:0030291~protein serine/threonine kinase inhibitor activity	6	0.5046257359125316	0.04795805951110409	CDKN1C, PRKAR2B, PPP1R1B, PRKAG2, PKIG, CIT	1117	34	18869	2.981041655695403	1.0	0.435185134306476	0.41243931179549514
GOTERM_MF_ALL	GO:0003707	GO:0003707~steroid hormone receptor activity	5	0.42052144659377627	0.05024040053769781	PAQR8, NR4A3, PGR, ESR1, NR3C2	1117	24	18869	3.519285287973739	1.0	0.45330543212422797	0.42961251596156363
GOTERM_MF_ALL	GO:0022838	GO:0022838~substrate-specific channel activity	36	3.027754415475189	0.05224868560890854	KCNG1, RYR2, CLIC4, SLC24A3, TTYH3, KCNE4, GRIK5, GRIK3, ITPR1, CACNA1C, CACNA1H, RYR3, AQP1, TRPM2, KCNMB1, NCS1, ANXA6, SCN7A, KCNN3, SCN1B, KCNH2, KCND3, CACNA2D1, TRPC1, ABCC9, ANO5, GRIN2D, CACNB2, CACNB4, P2RX1, GPRIN1, KCNMA1, FXYD1, SCN4B, KCNK3, SLC26A6	1117	445	18869	1.3665898826109262	1.0	0.4670639831499896	0.44265194876620545
GOTERM_MF_ALL	GO:0005272	GO:0005272~sodium channel activity	7	0.5887300252312868	0.05251696051289635	TRPM2, GRIK5, GRIK3, SCN7A, SCN4B, CACNA1H, SCN1B	1117	46	18869	2.5706083842590792	1.0	0.4670639831499896	0.44265194876620545
GOTERM_MF_ALL	GO:0043177	GO:0043177~organic acid binding	21	1.7661900756938604	0.05264764041804038	RTN4R, GAD1, HBA2, TYMS, ACACB, SELE, GRIN2D, SELP, RBP7, FABP4, ACOX2, FABP6, APOC1, RBP1, OXER1, NAGS, PTGDS, AGRN, FOLR2, CD22, SLC19A1	1117	229	18869	1.5491002490294887	1.0	0.4670639831499896	0.44265194876620545
GOTERM_MF_ALL	GO:0043015	GO:0043015~gamma-tubulin binding	6	0.5046257359125316	0.053337223734442336	RACGAP1, FEZ1, DIXDC1, PDE4B, NDN, BRCA2	1117	35	18869	2.8958690369612485	1.0	0.47055284050163576	0.44595845400186507
GOTERM_MF_ALL	GO:0004866	GO:0004866~endopeptidase inhibitor activity	18	1.5138772077375946	0.05382773638623492	ITIH5, SERPINA3, SERPINF1, TFPI2, WFDC1, TFPI, CST6, C3, PTTG1, BIN1, COL7A1, BIRC5, A2M, GAS6, RECK, TIMP4, BIRC3, SNCA	1117	188	18869	1.6173736642602718	1.0	0.4722566043168014	0.44757316718941187
GOTERM_MF_ALL	GO:0005161	GO:0005161~platelet-derived growth factor receptor binding	4	0.33641715727502103	0.05507913564855109	PDGFRA, PDGFD, ITGB3, ITGA5	1117	15	18869	4.504685168606386	1.0	0.4805805901642809	0.45546208324763404
GOTERM_MF_ALL	GO:0031406	GO:0031406~carboxylic acid binding	20	1.682085786375105	0.05874352417440695	RTN4R, GAD1, TYMS, ACACB, SELE, GRIN2D, SELP, RBP7, FABP4, ACOX2, FABP6, APOC1, RBP1, OXER1, NAGS, PTGDS, AGRN, FOLR2, CD22, SLC19A1	1117	218	18869	1.5497770075480686	1.0	0.5060372123076088	0.479588164057274
GOTERM_MF_ALL	GO:0004175	GO:0004175~endopeptidase activity	38	3.1959629941127	0.05884396255517928	PCSK2, CFD, TPSD1, TPSB2, C1S, C1R, PCSK7, ECE2, ADAMTS12, USP18, PRSS23, THSD4, ADAMTSL1, ADAMTS4, ADAMTS15, ADAMTS5, ADAMTS1, ADAMTSL4, ADAMTSL3, CTSG, CTSF, TPSAB1, ADAMTS8, PAMR1, ADAMTS9, F10, MMP1, HGF, F12, USP2, ADAM33, MMP12, MMP11, SFRP1, MMP13, ESPL1, TLL1, MASP1	1117	479	18869	1.3401203267774737	1.0	0.5060372123076088	0.479588164057274
GOTERM_MF_ALL	GO:0015267	GO:0015267~channel activity	38	3.1959629941127	0.05975820479243402	KCNG1, RYR2, CLIC4, SLC24A3, TTYH3, KCNE4, GRIK5, GRIK3, ITPR1, CACNA1C, CACNA1H, RYR3, AQP1, TRPM2, GJC2, KCNMB1, NCS1, ANXA6, SCN7A, KCNN3, SCN1B, KCNH2, KCND3, CACNA2D1, TRPC1, ABCC9, ANO5, GRIN2D, CACNB2, CACNB4, P2RX1, GPRIN1, KCNMA1, FXYD1, BCL2, SCN4B, KCNK3, SLC26A6	1117	480	18869	1.3373284094300206	1.0	0.5060372123076088	0.479588164057274
GOTERM_MF_ALL	GO:0099626	GO:0099626~voltage-gated calcium channel activity involved in regulation of presynaptic cytosolic calcium levels	3	0.2523128679562658	0.0601715286804164	CACNB2, CACNB4, NCS1	1117	7	18869	7.239672592403122	1.0	0.5060372123076088	0.479588164057274
GOTERM_MF_ALL	GO:0099511	GO:0099511~voltage-gated calcium channel activity involved in regulation of cytosolic calcium levels	3	0.2523128679562658	0.0601715286804164	CACNB2, CACNB4, NCS1	1117	7	18869	7.239672592403122	1.0	0.5060372123076088	0.479588164057274
GOTERM_MF_ALL	GO:0005138	GO:0005138~interleukin-6 receptor binding	3	0.2523128679562658	0.0601715286804164	IL6, IL6ST, IL6R	1117	7	18869	7.239672592403122	1.0	0.5060372123076088	0.479588164057274
GOTERM_MF_ALL	GO:0030545	GO:0030545~receptor regulator activity	13	1.0933557611438183	0.06022735083509953	LYNX1, TNFSF12, NCAPG2, SEMA3E, WNT9A, AREG, DKK1, GREM2, TAL1, CTSG, GAS6, WNT2, HBEGF	1117	123	18869	1.785393511947653	1.0	0.5060372123076088	0.479588164057274
GOTERM_MF_ALL	GO:0022803	GO:0022803~passive transmembrane transporter activity	38	3.1959629941127	0.06129535048130237	KCNG1, RYR2, CLIC4, SLC24A3, TTYH3, KCNE4, GRIK5, GRIK3, ITPR1, CACNA1C, CACNA1H, RYR3, AQP1, TRPM2, GJC2, KCNMB1, NCS1, ANXA6, SCN7A, KCNN3, SCN1B, KCNH2, KCND3, CACNA2D1, TRPC1, ABCC9, ANO5, GRIN2D, CACNB2, CACNB4, P2RX1, GPRIN1, KCNMA1, FXYD1, BCL2, SCN4B, KCNK3, SLC26A6	1117	481	18869	1.3345481008865072	1.0	0.5123000871805693	0.48552369723347405
GOTERM_MF_ALL	GO:0005246	GO:0005246~calcium channel regulator activity	7	0.5887300252312868	0.06238585160069844	PRKCB, RRAD, NRXN1, ITPR1, NRXN2, PRKG1, GEM	1117	48	18869	2.4634997015816174	1.0	0.5186844625230844	0.49157438041388035
GOTERM_MF_ALL	GO:0005244	GO:0005244~voltage-gated ion channel activity	19	1.59798149705635	0.06322053962752587	KCNG1, KCNH2, CLIC4, KCND3, KCNE4, CACNA2D1, ABCC9, CACNA1C, CACNA1H, GRIN2D, CACNB2, CACNB4, KCNMA1, NCS1, SCN7A, KCNN3, SCN4B, KCNK3, SCN1B	1117	206	18869	1.558052515840801	1.0	0.520559843270322	0.49335174063087817
GOTERM_MF_ALL	GO:0001871	GO:0001871~pattern binding	5	0.42052144659377627	0.06446722446295532	EPM2A, PPP1R3B, ENPP2, ENPP1, PTX3	1117	26	18869	3.248571035052682	1.0	0.520559843270322	0.49335174063087817
GOTERM_MF_ALL	GO:0030247	GO:0030247~polysaccharide binding	5	0.42052144659377627	0.06446722446295532	EPM2A, PPP1R3B, ENPP2, ENPP1, PTX3	1117	26	18869	3.248571035052682	1.0	0.520559843270322	0.49335174063087817
GOTERM_MF_ALL	GO:0004435	GO:0004435~phosphatidylinositol phospholipase C activity	5	0.42052144659377627	0.06446722446295532	EDNRA, PLCB4, PLCL1, BDKRB2, PLCD4	1117	26	18869	3.248571035052682	1.0	0.520559843270322	0.49335174063087817
GOTERM_MF_ALL	GO:0005104	GO:0005104~fibroblast growth factor receptor binding	5	0.42052144659377627	0.06446722446295532	KL, FGF7, FLRT2, NRXN1, FGF2	1117	26	18869	3.248571035052682	1.0	0.520559843270322	0.49335174063087817
GOTERM_MF_ALL	GO:0005523	GO:0005523~tropomyosin binding	4	0.33641715727502103	0.06490607617602251	TMOD1, CALD1, TNNT2, LMOD1	1117	16	18869	4.223142345568487	1.0	0.520559843270322	0.49335174063087817
GOTERM_MF_ALL	GO:0050998	GO:0050998~nitric-oxide synthase binding	4	0.33641715727502103	0.06490607617602251	CAV1, ATP2B4, DMD, SNTA1	1117	16	18869	4.223142345568487	1.0	0.520559843270322	0.49335174063087817
GOTERM_MF_ALL	GO:0022832	GO:0022832~voltage-gated channel activity	19	1.59798149705635	0.06560172833876232	KCNG1, KCNH2, CLIC4, KCND3, KCNE4, CACNA2D1, ABCC9, CACNA1C, CACNA1H, GRIN2D, CACNB2, CACNB4, KCNMA1, NCS1, SCN7A, KCNN3, SCN4B, KCNK3, SCN1B	1117	207	18869	1.5505256920927777	1.0	0.5234951990047968	0.4961336741197854
GOTERM_MF_ALL	GO:0019894	GO:0019894~kinesin binding	7	0.5887300252312868	0.06770315790772949	KLC3, KIF18B, PRC1, MAPK8IP2, LRP8, SYBU, SNCA	1117	49	18869	2.4132241974677067	1.0	0.5375630737873721	0.5094662632556645
GOTERM_MF_ALL	GO:0099604	GO:0099604~ligand-gated calcium channel activity	5	0.42052144659377627	0.07228735339591122	RYR2, TRPM2, ITPR1, RYR3, GRIN2D	1117	27	18869	3.1282535893099905	1.0	0.5711060556851095	0.5412560540340616
GOTERM_MF_ALL	GO:0005525	GO:0005525~GTP binding	32	2.6913372582001682	0.07320176532303997	DIRAS3, RASL12, GNAZ, NPR1, RRAD, NPR2, DIRAS1, LRRK2, GIMAP1, RASL11A, AK4, RND3, RERG, GNA14, RNF112, TUBB6, RASD1, RRAS, TUBB3, RAB23, ANXA6, RAC3, GBP6, RHOH, GEM, RHOB, GNAO1, EHD2, GNAL, RAB37, RHOJ, RAB9B	1117	399	18869	1.3547925319116951	1.0	0.5754673432326113	0.5453893901543324
GOTERM_MF_ALL	GO:0035497	GO:0035497~cAMP response element binding	4	0.33641715727502103	0.07547384788247266	NR4A3, CREB3L1, JDP2, CREB5	1117	17	18869	3.9747222075938704	1.0	0.5862088360415718	0.5555694573315904
GOTERM_MF_ALL	GO:0005005	GO:0005005~transmembrane-ephrin receptor activity	4	0.33641715727502103	0.07547384788247266	EFNA3, EPHA7, EPHB2, EPHA3	1117	17	18869	3.9747222075938704	1.0	0.5862088360415718	0.5555694573315904
GOTERM_MF_ALL	GO:0072509	GO:0072509~divalent inorganic cation transmembrane transporter activity	17	1.4297729184188395	0.0761627415519365	RYR2, SLC24A3, CACNA2D1, TRPC1, ATP2A3, ATP2B4, ITPR1, CACNA1C, CACNA1H, SLC8A1, RYR3, GRIN2D, CACNB2, TRPM2, CACNB4, NCS1, ANXA6	1117	183	18869	1.5692550792276345	1.0	0.5862088360415718	0.5555694573315904
GOTERM_MF_ALL	GO:0035174	GO:0035174~histone serine kinase activity	3	0.2523128679562658	0.07715217048657966	PRKAA2, AURKB, AURKA	1117	8	18869	6.334713518352731	1.0	0.5862088360415718	0.5555694573315904
GOTERM_MF_ALL	GO:0090554	GO:0090554~phosphatidylcholine-translocating ATPase activity	3	0.2523128679562658	0.07715217048657966	ABCB1, ATP8B2, ABCB4	1117	8	18869	6.334713518352731	1.0	0.5862088360415718	0.5555694573315904
GOTERM_MF_ALL	GO:0004897	GO:0004897~ciliary neurotrophic factor receptor activity	3	0.2523128679562658	0.07715217048657966	LIFR, IL6ST, IL6R	1117	8	18869	6.334713518352731	1.0	0.5862088360415718	0.5555694573315904
GOTERM_MF_ALL	GO:0017108	GO:0017108~5'-flap endonuclease activity	3	0.2523128679562658	0.07715217048657966	FEN1, EXO1, DNA2	1117	8	18869	6.334713518352731	1.0	0.5862088360415718	0.5555694573315904
GOTERM_MF_ALL	GO:0000976	GO:0000976~transcription regulatory region sequence-specific DNA binding	106	8.915054667788057	0.07772089596035618	ZNF331, NR3C2, SOX17, MYC, CREB3L1, MYB, PITX2, SOX7, JUNB, PITX1, SOX4, PKNOX2, KCNH2, MEF2C, EBF1, ARID5A, EBF3, MITF, SOX10, HIC1, FOXP2, PGR, ATF3, ZNF671, GATA6, TWIST2, CREM, GATA5, NACC2, PRDM16, NDN, OTX1, ZNF423, ZSCAN18, EGR1, EGR2, JUND, EGR3, FOXF1, ZBTB16, NR2F1, SMAD9, ESR1, POU6F1, NFATC4, NR4A2, FOSL1, NR4A1, NR4A3, MAFF, SIM2, ZNF135, EZH2, BNC2, THRA, TCF21, SIX1, HIF3A, BRCA1, FOXM1, MEOX2, MEOX1, JPH2, SIX4, MYBL2, PEG3, TFEB, FOS, ETV4, KLF15, MMP12, ZEB2, ZEB1, TAL1, HAND2, CRY2, IRF5, JDP2, CREB5, HDAC4, HLF, NFIX, ZNF471, CEBPD, ZBTB47, UHRF1, SRF, ATOH8, E2F1, E2F2, MSX1, E2F7, E2F8, SNCA, KLF4, TBX5, KLF2, PER2, PER1, KLF6, PER3, NFIA, NFIB, KLF9, FOSB, ZFP28	1117	1551	18869	1.1544889455325844	1.0	0.5877180132621219	0.5569997543825527
GOTERM_MF_ALL	GO:0015081	GO:0015081~sodium ion transmembrane transporter activity	15	1.2615643397813288	0.07862389094778277	SLC22A3, SLC24A3, GRIK5, GRIK3, ATP1A2, SLC4A4, CACNA1H, SLC8A1, SLC5A6, TRPM2, SLC9A7, SLC9A9, SCN7A, SCN4B, SCN1B	1117	156	18869	1.624285517526341	1.0	0.5917286200240712	0.5608007387507729
GOTERM_MF_ALL	GO:0050681	GO:0050681~androgen receptor binding	5	0.42052144659377627	0.08056578703630721	PRKCB, TGFB1I1, ARID5A, TCF21, FOXP2	1117	28	18869	3.0165302468346336	1.0	0.603483348177622	0.571941082498313
GOTERM_MF_ALL	GO:0032550	GO:0032550~purine ribonucleoside binding	32	2.6913372582001682	0.08280136190553912	DIRAS3, RASL12, GNAZ, NPR1, RRAD, NPR2, DIRAS1, LRRK2, GIMAP1, RASL11A, AK4, RND3, RERG, GNA14, RNF112, TUBB6, RASD1, RRAS, TUBB3, RAB23, ANXA6, RAC3, GBP6, RHOH, GEM, RHOB, GNAO1, EHD2, GNAL, RAB37, RHOJ, RAB9B	1117	404	18869	1.3380252976058573	1.0	0.6173171958027988	0.5850518763748186
GOTERM_MF_ALL	GO:0061135	GO:0061135~endopeptidase regulator activity	18	1.5138772077375946	0.08465311328747882	ITIH5, SERPINA3, SERPINF1, TFPI2, WFDC1, TFPI, CST6, C3, PTTG1, BIN1, COL7A1, BIRC5, A2M, GAS6, RECK, TIMP4, BIRC3, SNCA	1117	200	18869	1.5203312444046555	1.0	0.6281735696285812	0.5953408200825029
GOTERM_MF_ALL	GO:0044212	GO:0044212~transcription regulatory region DNA binding	106	8.915054667788057	0.08607098832111554	ZNF331, NR3C2, SOX17, MYC, CREB3L1, MYB, PITX2, SOX7, JUNB, PITX1, SOX4, PKNOX2, KCNH2, MEF2C, EBF1, ARID5A, EBF3, MITF, SOX10, HIC1, FOXP2, PGR, ATF3, ZNF671, GATA6, TWIST2, CREM, GATA5, NACC2, PRDM16, NDN, OTX1, ZNF423, ZSCAN18, EGR1, EGR2, JUND, EGR3, FOXF1, ZBTB16, NR2F1, SMAD9, ESR1, POU6F1, NFATC4, NR4A2, FOSL1, NR4A1, NR4A3, MAFF, SIM2, ZNF135, EZH2, BNC2, THRA, TCF21, SIX1, HIF3A, BRCA1, FOXM1, MEOX2, MEOX1, JPH2, SIX4, MYBL2, PEG3, TFEB, FOS, ETV4, KLF15, MMP12, ZEB2, ZEB1, TAL1, HAND2, CRY2, IRF5, JDP2, CREB5, HDAC4, HLF, NFIX, ZNF471, CEBPD, ZBTB47, UHRF1, SRF, ATOH8, E2F1, E2F2, MSX1, E2F7, E2F8, SNCA, KLF4, TBX5, KLF2, PER2, PER1, KLF6, PER3, NFIA, NFIB, KLF9, FOSB, ZFP28	1117	1558	18869	1.1493018963549668	1.0	0.6312366166172828	0.5982437707865306
GOTERM_MF_ALL	GO:0000975	GO:0000975~regulatory region DNA binding	106	8.915054667788057	0.08607098832111554	ZNF331, NR3C2, SOX17, MYC, CREB3L1, MYB, PITX2, SOX7, JUNB, PITX1, SOX4, PKNOX2, KCNH2, MEF2C, EBF1, ARID5A, EBF3, MITF, SOX10, HIC1, FOXP2, PGR, ATF3, ZNF671, GATA6, TWIST2, CREM, GATA5, NACC2, PRDM16, NDN, OTX1, ZNF423, ZSCAN18, EGR1, EGR2, JUND, EGR3, FOXF1, ZBTB16, NR2F1, SMAD9, ESR1, POU6F1, NFATC4, NR4A2, FOSL1, NR4A1, NR4A3, MAFF, SIM2, ZNF135, EZH2, BNC2, THRA, TCF21, SIX1, HIF3A, BRCA1, FOXM1, MEOX2, MEOX1, JPH2, SIX4, MYBL2, PEG3, TFEB, FOS, ETV4, KLF15, MMP12, ZEB2, ZEB1, TAL1, HAND2, CRY2, IRF5, JDP2, CREB5, HDAC4, HLF, NFIX, ZNF471, CEBPD, ZBTB47, UHRF1, SRF, ATOH8, E2F1, E2F2, MSX1, E2F7, E2F8, SNCA, KLF4, TBX5, KLF2, PER2, PER1, KLF6, PER3, NFIA, NFIB, KLF9, FOSB, ZFP28	1117	1558	18869	1.1493018963549668	1.0	0.6312366166172828	0.5982437707865306
GOTERM_MF_ALL	GO:0015278	GO:0015278~calcium-release channel activity	4	0.33641715727502103	0.08674355910295221	RYR2, TRPM2, ITPR1, RYR3	1117	18	18869	3.7539043071719886	1.0	0.6312366166172828	0.5982437707865306
GOTERM_MF_ALL	GO:0004523	GO:0004523~RNA-DNA hybrid ribonuclease activity	4	0.33641715727502103	0.08674355910295221	FEN1, RNASEH2A, EXO1, JUNB	1117	18	18869	3.7539043071719886	1.0	0.6312366166172828	0.5982437707865306
GOTERM_MF_ALL	GO:0004871	GO:0004871~signal transducer activity	121	10.176619007569386	0.0870534124931895	VIPR2, MRGPRF, ANTXR2, CELSR3, NR3C2, EDNRA, EDNRB, EFEMP1, TUBB3, LEPR, OXER1, MAP3K8, EPHB2, IL6R, PAQR8, PDGFRA, EPHA7, PAQR4, IL11RA, LIFR, UNC5C, MELK, GPRIN1, AGTR1, ROR1, PGR, ROR2, IL6ST, EPHA3, RTN4R, PTGFR, PKDCC, KLRB1, NPR1, NPR2, LPAR1, ITPR1, LTBP4, ADRB2, CD79B, TRPM2, HCAR1, WNT2, NGFR, PTPRN2, FZD2, TNFSF12, FZD7, PTCH2, NR2F1, L1CAM, BMX, SELE, ESR1, GRIN2D, NR4A2, IL22RA1, PTPRD, NR4A1, EFNA3, NR4A3, GPR183, CSPG4, FGFR1, RYR2, THRA, LRRK2, GRIK5, ITGB3, GRIK3, PTH1R, AREG, RYR3, GHR, FCRLB, CLEC1A, PBK, BDKRB2, BDKRB1, FCER1A, CTSG, ABCC9, GFRA1, SORCS1, WNT9A, TACR1, GFRA3, SORCS2, ADRA2A, RGMA, TGFBR2, TGFBR3, GREM2, TAL1, CRY2, KIT, GAS6, HBEGF, PTGER4, NRXN1, PTGER3, NRXN3, NRXN2, TTK, SEMA3E, LRP8, S1PR1, GPC6, NTRK2, P2RY14, LYVE1, MAPK15, LILRB5, AXL, P2RX1, CD69, FOLR2, LGR6, RAMP1, RECK, GPR146	1117	1800	18869	1.1355560529195265	1.0	0.6312366166172828	0.5982437707865306
GOTERM_MF_ALL	GO:0001067	GO:0001067~regulatory region nucleic acid binding	106	8.915054667788057	0.08775296766896662	ZNF331, NR3C2, SOX17, MYC, CREB3L1, MYB, PITX2, SOX7, JUNB, PITX1, SOX4, PKNOX2, KCNH2, MEF2C, EBF1, ARID5A, EBF3, MITF, SOX10, HIC1, FOXP2, PGR, ATF3, ZNF671, GATA6, TWIST2, CREM, GATA5, NACC2, PRDM16, NDN, OTX1, ZNF423, ZSCAN18, EGR1, EGR2, JUND, EGR3, FOXF1, ZBTB16, NR2F1, SMAD9, ESR1, POU6F1, NFATC4, NR4A2, FOSL1, NR4A1, NR4A3, MAFF, SIM2, ZNF135, EZH2, BNC2, THRA, TCF21, SIX1, HIF3A, BRCA1, FOXM1, MEOX2, MEOX1, JPH2, SIX4, MYBL2, PEG3, TFEB, FOS, ETV4, KLF15, MMP12, ZEB2, ZEB1, TAL1, HAND2, CRY2, IRF5, JDP2, CREB5, HDAC4, HLF, NFIX, ZNF471, CEBPD, ZBTB47, UHRF1, SRF, ATOH8, E2F1, E2F2, MSX1, E2F7, E2F8, SNCA, KLF4, TBX5, KLF2, PER2, PER1, KLF6, PER3, NFIA, NFIB, KLF9, FOSB, ZFP28	1117	1560	18869	1.147828432385281	1.0	0.6334168757196318	0.6003100742808852
GOTERM_MF_ALL	GO:0004629	GO:0004629~phospholipase C activity	5	0.42052144659377627	0.08929040632809948	EDNRA, PLCB4, PLCL1, BDKRB2, PLCD4	1117	29	18869	2.9125119624610254	1.0	0.6364654795221037	0.6031993367007343
GOTERM_MF_ALL	GO:0001883	GO:0001883~purine nucleoside binding	32	2.6913372582001682	0.08935234175282686	DIRAS3, RASL12, GNAZ, NPR1, RRAD, NPR2, DIRAS1, LRRK2, GIMAP1, RASL11A, AK4, RND3, RERG, GNA14, RNF112, TUBB6, RASD1, RRAS, TUBB3, RAB23, ANXA6, RAC3, GBP6, RHOH, GEM, RHOB, GNAO1, EHD2, GNAL, RAB37, RHOJ, RAB9B	1117	407	18869	1.3281627032746102	1.0	0.6364654795221037	0.6031993367007343
GOTERM_MF_ALL	GO:0017022	GO:0017022~myosin binding	9	0.7569386038687973	0.08937770902608888	ACTA1, ACTC1, GSN, CALD1, AXL, DMD, MYRIP, MYL9, IQGAP3	1117	78	18869	1.9491426210316096	1.0	0.6364654795221037	0.6031993367007343
GOTERM_MF_ALL	GO:0032549	GO:0032549~ribonucleoside binding	32	2.6913372582001682	0.09122738806833602	DIRAS3, RASL12, GNAZ, NPR1, RRAD, NPR2, DIRAS1, LRRK2, GIMAP1, RASL11A, AK4, RND3, RERG, GNA14, RNF112, TUBB6, RASD1, RRAS, TUBB3, RAB23, ANXA6, RAC3, GBP6, RHOH, GEM, RHOB, GNAO1, EHD2, GNAL, RAB37, RHOJ, RAB9B	1117	408	18869	1.32490740253129	1.0	0.6439125215995154	0.6102571442111276
GOTERM_MF_ALL	GO:0042826	GO:0042826~histone deacetylase binding	13	1.0933557611438183	0.09123445677574997	TOP2A, HDAC4, MEF2C, MYOCD, SRF, TCF21, KLF4, HIC1, CDC20, TAL1, NACC2, DNMT3B, KPNA2	1117	132	18869	1.6636621361330404	1.0	0.6439125215995154	0.6102571442111276
GOTERM_MF_ALL	GO:0048306	GO:0048306~calcium-dependent protein binding	10	0.8410428931875525	0.09373963104803397	SELP, NRXN1, ANXA6, ATP2B4, CASQ2, RAC3, MASP1, A2M, S100B, LRP8	1117	92	18869	1.836148845899342	1.0	0.6586660801074246	0.6242395784393412
GOTERM_MF_ALL	GO:0031821	GO:0031821~G-protein coupled serotonin receptor binding	3	0.2523128679562658	0.09541240211376624	GNAO1, GNAZ, GNA14	1117	9	18869	5.630856460757983	1.0	0.6616370941338899	0.6270553064682017
GOTERM_MF_ALL	GO:0010997	GO:0010997~anaphase-promoting complex binding	3	0.2523128679562658	0.09541240211376624	CDC20, PLK1, CLSPN	1117	9	18869	5.630856460757983	1.0	0.6616370941338899	0.6270553064682017
GOTERM_MF_ALL	GO:0048256	GO:0048256~flap endonuclease activity	3	0.2523128679562658	0.09541240211376624	FEN1, EXO1, DNA2	1117	9	18869	5.630856460757983	1.0	0.6616370941338899	0.6270553064682017
GOTERM_MF_ALL	GO:0022890	GO:0022890~inorganic cation transmembrane transporter activity	41	3.4482758620689653	0.09595371290955768	KCNG1, SLC22A3, RYR2, SLC24A3, KCNE4, GRIK5, COX4I2, GRIK3, ATP2A3, ITPR1, ATP1A2, CACNA1C, COX7A1, SLC4A4, CACNA1H, SLC8A1, RYR3, AQP1, TRPM2, KCNMB1, NCS1, ANXA6, SCN7A, KCNN3, SCN1B, KCNH2, KCND3, CACNA2D1, TRPC1, ATP2B4, ABCC9, GRIN2D, SLC5A6, CACNB2, CACNB4, SLC9A7, KCNMA1, SLC9A9, SLC25A4, SCN4B, KCNK3	1117	548	18869	1.2638601180168465	1.0	0.6624978091320765	0.62787103447341
GOTERM_MF_ALL	GO:0008270	GO:0008270~zinc ion binding	62	5.214465937762826	0.09710227292511772	ZNF331, BNC2, THRA, CPXM2, MT1M, BRCA1, NR3C2, ZDBF2, RNF112, ADAMTS5, CSRP1, ADAMTS1, ENPP2, ENPP1, CA9, TK1, ADAMTS8, ADAMTS9, LMCD1, ZCCHC24, CPA3, PRKCB, MMP1, BHMT2, MYRIP, NAALADL1, MMP12, MMP11, ZEB1, MMP13, RGN, BIRC5, PGR, SMPDL3B, ZFPM2, PDZRN3, HDAC4, BLM, ADH1C, UHRF1, ADH1B, PRICKLE2, GATA6, GATA5, CRIP2, ADAMTS15, DMD, SNCA, EGR1, DTNA, PDE2A, ADAM33, NR2F1, S100B, KLF4, ESR1, NR4A2, NR4A1, NR4A3, MSRB3, TLL1, CDO1	1117	874	18869	1.198328720481676	1.0	0.6675255818402033	0.6326360205727367
GOTERM_MF_ALL	GO:0051117	GO:0051117~ATPase binding	10	0.8410428931875525	0.09865081811879042	PLN, TRPC1, PDE4D, CAV1, PGR, ANK2, SNX10, ATP1B2, ESR1, SNTA1	1117	93	18869	1.8164053099219297	1.0	0.6698881133879196	0.6348750696780976
GOTERM_MF_ALL	GO:0005003	GO:0005003~ephrin receptor activity	4	0.33641715727502103	0.09867342514921966	EFNA3, EPHA7, EPHB2, EPHA3	1117	19	18869	3.5563303962682	1.0	0.6698881133879196	0.6348750696780976
